created_utc,date,body,negative,neutral,positive,compound,score
1489685307,2017-03-16,"[Trade link](https://steamcommunity.com/tradeoffer/new/?partner=315800756&amp;token=x07a97WN) 300 I really don't know about the spectrum case much as I just started the game, but I would like to roll that gold rare item when I am opening cases. Thank you for giveaway",0.0,0.827,0.173,0.7579,1
1489696881,2017-03-16,[Trade URL](https://steamcommunity.com/tradeoffer/new/?partner=212274033&amp;token=TPyYCQN0) Number: 239 My favorite skin of the Spectrum Case is **Desert Eagle | Oxide Blaze** Thanks for the giveaway OP!,0.0,0.706,0.294,0.7574,1
1489704030,2017-03-16,[Click for trade link](https://steamcommunity.com/tradeoffer/new/?partner=184751107&amp;token=XCU2Uw-t) :^) Oh sweet Spectrum Case How I long for you Until the splatter of blood is a background noise Until the sun turns into the night But you don't want to damn drop,0.097,0.733,0.17,0.4504,1
1489718730,2017-03-17,[Trade Link](https://steamcommunity.com/tradeoffer/new/?partner=117534874&amp;token=GbMH35gl) 245 My favorite skin in the Spectrum case has to be the XM Seasons,0.0,0.833,0.167,0.4588,1
1489724556,2017-03-17,[Trade Link](https://steamcommunity.com/tradeoffer/new/?partner=283534762&amp;token=KlPmEe5K) 195 I'm in love with all the new tigertooth and doppler skins but the karambit tigertooth will always be my favourite. No matter how many new knives come out. Imo the Spectrum Case has one of the nicest collection of skins over all tha I've seen in a while. Thanks for the giveaway :),0.041,0.724,0.235,0.9201,1
1489784823,2017-03-17,Hey dank what do you think about the sexy new knives on the Spectrum case?,0.0,0.805,0.195,0.5267,2
1489936290,2017-03-19,[Trade Link](https://steamcommunity.com/tradeoffer/new/?partner=212274033&amp;token=TPyYCQN0) Number 28 Good Luck getting a case drop from the spectrum case!,0.113,0.484,0.403,0.6588,1
1489938485,2017-03-19,https://steamcommunity.com/tradeoffer/new/?partner=211360981&amp;token=0z6D0Hhp 25 Good luck on ez $$ spectrum case!,0.0,0.408,0.592,0.8268,1
1489946213,2017-03-19,[Trade link](https://steamcommunity.com/tradeoffer/new/?partner=103846731&amp;token=xkD9eNgH) I WISH YOU the best of luck in getting a spectrum case so you can sell it instantly for some easy profit !!! 26 TY !,0.0,0.476,0.524,0.968,1
1489950763,2017-03-19,[trade link] (https://steamcommunity.com/tradeoffer/new/?partner=363387442&amp;token=E4jV5BUG) good luck getting a spectrum case drop for ez $$$ 86 thanks for the giveaway,0.174,0.407,0.419,0.765,1
1489957692,2017-03-19,[Trade Link] (https://steamcommunity.com/tradeoffer/new/?partner=105654942&amp;token=-Cb7nBvR) Good luck on spectrum case drops OP! 72,0.0,0.592,0.408,0.7345,1
1490047630,2017-03-20,[Trade Link](https://steamcommunity.com/tradeoffer/new/?partner=362421646&amp;token=G5H7efoZ) good lucking getting a spectrum case i need some of them too :),0.0,0.552,0.448,0.7964,1
1490050313,2017-03-20,[Click for trade link](https://steamcommunity.com/tradeoffer/new/?partner=184751107&amp;token=XCU2Uw-t) I gave up on a spectrum case ;^),0.0,0.789,0.211,0.34,1
1490052203,2017-03-20,[Trade Link](https://steamcommunity.com/tradeoffer/new/?partner=101871721&amp;token=2yLvI5ox) GOOOOOOODDDDDD LUUUUUUUCCCCCCKKKKK RNG pls giff spectrum case!! Thanks for the giveaway!,0.0,0.684,0.316,0.6219,1
1490056098,2017-03-21,[Trade link](https://steamcommunity.com/tradeoffer/new/?partner=282270466&amp;token=qA6HHsFe) Get dat Spectrum case booooooooooooooiiiiiiiiiiiiiii,0.0,1.0,0.0,0.0,1
1490062583,2017-03-21,"[Trade Link](http://brostrick-prod.s3.amazonaws.com/wp-content/uploads/2015/10/05085905/cat-memes-6.png) Now I feel bad for getting a Spectrum Case as a drop on the second day of release at the end of my first competitive match after a month long break from CS:GO. :( Good luck to you though, and thank you for the giveaway!",0.155,0.656,0.189,0.2244,1
1490064615,2017-03-21,"Where I'm from we have internet and gaming cafes where you can go to play CS 1.6, CS:GO, Dota and the sort. If you go to a place like this and you don't have a Steam account of your own, an account is provided to you by the establishment (sometimes for a small fee). We got one of our friends who hasn't played CS since 1.6 to play a comp game with us, and he got a Spectrum Case at the end. We talked to the admin at the place and he allowed us to trade the case to the account of another friend who actually plays CS:GO. Sorry for the long read. :p",0.027,0.824,0.148,0.9282,1
1490133966,2017-03-21,[Trade link](https://steamcommunity.com/tradeoffer/new/?partner=21312443&amp;token=982HoRp6) 645 I mean anomaly is swimming in them at this point and i heard he got a spectrum case knife,0.0,1.0,0.0,0.0,1
1490145853,2017-03-22,"[Trade link](https://steamcommunity.com/tradeoffer/new/?partner=382660848&amp;token=O92-McLY) 572 I've never opened any cases and don't really plan on it. My friend got a spectrum case yesterday as well. I sold it for him and a couple of guns of mine and bought our friend an AWP Sun in Leo as an early birthday present. It was amazing, i threw the gun to him in private casual and he was all like ""no man, it's not mine"" and just kept throwing the gun back to me and running around CT spawn. It was beautiful lol. Thank you for the giveaway!",0.063,0.702,0.235,0.9589,1
1490168039,2017-03-22,"1.[trade link](https://steamcommunity.com/tradeoffer/new/?partner=123880960&amp;token=OuExXDTU) 2. Work. Don't use methods you found in the internet - unless it are job applications. Maybe sell some useless shit- ~~like your gf~~ 3. 66 4. Didn't unbox anything, cuz fuk u gAbEn - but I got 2 Spectrum Cases yesterday - so yeeeeeeeeeeeeeeeeee. [steam profile](http://steamcommunity.com/id/Thoxinator/) Thanks for making the community nicer! ( ͡° ͜ʖ ͡°) Edit: I can't count.",0.066,0.807,0.126,0.6996,2
1490212193,2017-03-22,[trade link] (https://steamcommunity.com/tradeoffer/new/?partner=363387442&amp;token=E4jV5BUG) 87 I have opened up one case in my life and got a three cent skin. Do not open cases its a waste of money. you would be better off selling your spectrum case for a few dollars than opening it and getting some garbage tier skin imo thanks for the giveaway,0.049,0.848,0.102,0.4588,1
1490323644,2017-03-24,I get it xD [Trade link :)](https://steamcommunity.com/tradeoffer/new/?partner=380987817&amp;token=aE1_gbiq) 74 you got 2 spectrum cases? ;-; I just got a chroma 2 case 2 days ago I hate my luck ;-;,0.124,0.636,0.24,0.5362,1
1490339200,2017-03-24,"nah i've only got one spectrum case drop, although valve has gifted me a few wildfire, shadow and falchion cases while they were hot :&gt;",0.137,0.863,0.0,-0.3612,1
1490663373,2017-03-28,"Sorry to hear it OP, if it makes you feel any better, I bought a Spectrum case for 8 bucks and a Key for the 2.50, and unboxed a P250 Ripple MW. Also got a bunch of other low price skins that day. Thanks for the giveaway though, hope it makes you feel better about the poor luck!",0.099,0.673,0.228,0.8553,1
1490670425,2017-03-28,Why don't you try opening the spectrum case ;) [Trade link :)](https://steamcommunity.com/tradeoffer/new/?partner=380987817&amp;token=aE1_gbiq) Thank you!,0.0,0.719,0.281,0.5707,4
1490675510,2017-03-28,[Trade Link](https://steamcommunity.com/tradeoffer/new/?partner=83001090&amp;token=bLpmLf-R) Open a spectrum case! Thanks for the giveaway!,0.0,0.697,0.303,0.5399,1
1490715406,2017-03-28,Spectrum cases are pretty good but still expensive... So probably gamma 3 [Trade link](https://steamcommunity.com/tradeoffer/new/?partner=129329546&amp;token=0vX7gPJT) Thank you!,0.0,0.612,0.388,0.7644,1
1490719796,2017-03-28,"[Trade Link](https://steamcommunity.com/tradeoffer/new/?partner=284818522&amp;token=Sw5QnjZD) If you have a Spectrum case, i'll advise you to go for it! But if not, i'd go for the Gamma 2 case :) Thanks and good luck again!",0.0,0.606,0.394,0.9537,1
1490746271,2017-03-29,Open the spectrum case! [Trade](https://steamcommunity.com/tradeoffer/new/?partner=86915867&amp;token=uWlqzlOz),0.0,1.0,0.0,0.0,1
1490751032,2017-03-29,* 1. Open the new spectrum case * 2. if not try opening one of the gamma cases they have really nice knives and some cool skins * 3. [Trade Link](https://steamcommunity.com/tradeoffer/new/?partner=191408064&amp;token=6UzURHBI),0.0,0.828,0.172,0.659,1
1490771849,2017-03-29,You can go for spectrum cases. Thank you! [Trade link ](https://steamcommunity.com/tradeoffer/new/?partner=299609254&amp;token=2980DF0B),0.0,0.782,0.218,0.4199,1
1491187413,2017-04-03,"I'm good...just got a spectrum case, didn't even realize until someone tried scamming me...lol 66 [Trade Link](https://steamcommunity.com/tradeoffer/new/?partner=168573921&amp;token=QLqY7-GU)",0.0,1.0,0.0,0.0,1
1491674380,2017-04-08,[Trade link](https://steamcommunity.com/tradeoffer/new/?partner=382660848&amp;token=O92-McLY) I got a spectrum case recently and bought an AK Emerald Pinstripe with 4 nice stickers and a M4 Nitro with a Kimberly sticker. I like them both. I like the AK more tho. Thank you for the giveaway!,0.0,0.734,0.266,0.8711,1
1491879656,2017-04-11,[Steam profile](http://steamcommunity.com/id/ri0t333/) [Trade link](https://steamcommunity.com/tradeoffer/new/?partner=39068142&amp;token=mut5n0k1) My favourite would be [mac 10| Neon rider](https://csgostash.com/img/skins/large_1920/s553.png) Some of the skins from the spectrum case are simply beautiful - decimator and Neo-noir Thanks for the giveaway!,0.0,0.798,0.202,0.7959,1
1492360148,2017-04-16,"Unboxing is a terrible idea, and the spectrum cases will fall in price, so it's like you're losing money twice. 1299 4249 2136 1587 Thanks!",0.189,0.632,0.179,-0.0807,1
1492416487,2017-04-17,"161, 235, 318, 3108, 2303, 520, 1311, 1402, 2512, 2312, 05, 23, 31, 5123, 7549, 8931, 934, 2438, 6387, 4321 Congrats on your trade up I personally don't think you should unbox a spectrum case but then again its a little bit of fun hoping that you may get something really nice so YOLO but generally speaking you are better using that key to trade up, but I am more conservative! GL and thanks for the giveaway!",0.0,0.668,0.332,0.9876,1
1492539063,2017-04-18,333 [Trade link](https://steamcommunity.com/tradeoffer/new/?partner=200812120&amp;token=iVP0Cfc1) Thanks for the giveaway bull! Spectrum case hype!,0.0,0.742,0.258,0.5399,1
1493123314,2017-04-25,[Trade Link!](https://steamcommunity.com/tradeoffer/new/?partner=123989917&amp;token=vg6j-Kqu) [Profile!](http://steamcommunity.com/id/17324234/) I bought 2 spectrum cases. Opened them. I got a Deagle FT Oxide Blaze (80 cents) And a BS Scar-20 Blueprint (13 cents) I wanna kms,0.0,1.0,0.0,0.0,1
1493608579,2017-05-01,Yesterday I played a comp match and got a spectrum case. Best thing that's happened in a bit. Glove case please,0.0,0.611,0.389,0.836,1
1493738839,2017-05-02,"[Trade Link](https://steamcommunity.com/tradeoffer/new/?partner=83630725&amp;token=-h9ZJvJT) That's a nice collection! Really hoping to win - I admit to having SOME of the skins and not being a total newbie (200 hrs of playtime, but I only was able to use the market last week. I have a USP, glock, p250 skin that I got from selling my 2 spectrum cases XD)",0.0,0.843,0.157,0.7327,1
1493804624,2017-05-03,Wow just realized you were the same guy giving away spectrum case/keys. Really appreciate your generosity to this community! Can you tell me how an average day in your life goes?,0.0,0.674,0.326,0.9193,1
1493818453,2017-05-03,"[Trade Link](https://steamcommunity.com/tradeoffer/new/?partner=83630725&amp;token=-h9ZJvJT) [Profile Link](http://steamcommunity.com/id/chillxdd/) I would love to have that Deagle skin, I don't have one for it yet. I wanted to choose the AK but I have a safari mesh for it so it might not be an option. Still. Thanks for the giveaway! Edit: Definitely looking to get the Deagle now, since I picked up another Spectrum case, sold my Safari Mesh and the case on the market and got myself a FT AK Elite build :D Edit: Won a deagle directive from another GA so.. Tec-9 Re-entry, final answer! XD",0.0,0.742,0.258,0.9841,1
1494635571,2017-05-13,The Spectrum Case/Collection is by FAR the best thing. It turns the game into an acid trip. One skin I would LOVE to get is the PPBizon Judgment of Anubis in any wear. I think that skin is awesome because I am a total NERD for other cultures. [Link to the Profile] (http://steamcommunity.com/id/cm_pickle/) Thanks for the giveaway :),0.042,0.685,0.273,0.9531,1
1494639222,2017-05-13,"[Profile Link](http://steamcommunity.com/id/chillxdd/) For the GA, I think if I win, a StatTrak™ USP-S | Guardian (FN) would be nice. I don't really like the USP Torque I have, bought it impulsively after selling Spectrum Cases and I just don't feel it. [SteamAnalyst](https://csgo.steamanalyst.com/id/6285/StatTrak-USP-S-Guardian-Factory-New) lists the skin at around $6.39 at FN. With regard to the last question, I am not sure since I've only been playing for around 2 months or less, but I was here during the Negev and R8 remake and price drop so that was nice. The Negev is really something when used correctly. I've seen people push sites with it, lol. Thanks for the GA man! Hope I win :D",0.045,0.705,0.249,0.9818,1
1494662164,2017-05-13,"[Steam profile](http://www.steamcommunity.com/id/prakharr_singh) The AK-47 Red Laminate FT is $10.05, if I can't have that, then an M4A1-S HyperBeast WW which is around $9.5. I got the game this year, so I don't really know about a lot of major updates but I think the Spectrum Case skins were pretty nice especially the Neo-Noir and the Bloodsport. Thank you for the giveaway!",0.0,0.821,0.179,0.9108,1
1494786450,2017-05-14,"[T^r^a^d^e^l^i^n^k](https://steamcommunity.com/tradeoffer/new/?partner=313672448&amp;token=_dvvFJl2) I'm not exactly sure man, I definitely think they have gone down as the price of the spectrum case has gone down. I can't see it being worth more than 5 keys now. [TANKS YOU](https://upload.wikimedia.org/wikipedia/commons/thumb/4/44/Firing_M1A1_tank_in_Djibouti.jpg/1200px-Firing_M1A1_tank_in_Djibouti.jpg)",0.054,0.821,0.126,0.3895,1
1494897897,2017-05-16,"Depending on what I get, I either sell it or keep it. For example, I sold the spectrum case I last bought. If I was to host a giveaway, it would be none of my business as to what they do with the skin. Even if I disprove of an action, there is nothing I can do about it. [Trade Link](https://steamcommunity.com/tradeoffer/new/?partner=184888038&amp;token=pWngFMje) Thanks",0.0,0.948,0.052,0.4404,1
1495393933,2017-05-21,"Red Velvet 레드벨벳_행복(Happiness)_Music Video (not really a kpop fun but this is a song my best friend sent me a while back and its awesome!) btw, I have a spectrum case so I might actually use the key if I win :D [Trade Link](https://steamcommunity.com/tradeoffer/new/?partner=176332603&amp;token=_LAVhkjZ) thanks for the giveaway!",0.0,0.559,0.441,0.9843,1
1495794638,2017-05-26,"1. the best drop i got was an ak47 safari mash ft :') 2. a few days ago playing with some ppl from this subreddit, used it for a trade i think 3. WEW, lol, again? :D 4. i dont watch hockey ... :( thanks for the GA :^ edit. i got a spectrum case too ... i totally forgot about spectrum cases",0.07,0.662,0.268,0.9329,1
1495795357,2017-05-26,"I got a spectrum case in the early stages of it's release. I had a deal with my friends to contribute and open the spectrum case, for whoever found it first. We did that. Got a shitty skin from it. But it was fun. WEW LAD. Naah. More of a soccer person.",0.044,0.83,0.125,0.6369,1
1495797922,2017-05-26,Spectrum case. Sold it for 63c. WEW. And le Bruins of course!,0.0,1.0,0.0,0.0,1
1495798587,2017-05-26,Ahh only a spectrum case. Sold it. Only for ~20 cents I think. Still the best drop I've got though. WEW WEW WEW Bruins is cool,0.071,0.709,0.22,0.6597,1
1495801465,2017-05-26,spectrum case sold it for about 1$ WEW Thank you!,0.0,0.763,0.237,0.4199,1
1495803332,2017-05-26,I got a spectrum case and made 1 euro,0.0,1.0,0.0,0.0,1
1495804500,2017-05-26,"Spectrum case for 3 dollars WEW I don't follow hockey, I'm from aud",0.0,1.0,0.0,0.0,1
1495804698,2017-05-26,I got 2 back to back spectrum cases like 2 weeks after they came out. WEWWWWW I still have them and i want to open them. I don't like hockey but I like basketball. CELTICS!,0.0,0.746,0.254,0.7345,1
1495805364,2017-05-26,Spectrum case the hour or two it was released. Sold it for like 15. Bought a rebel wasteland FT. WEW. And preds are going to win. Even with Johansen out. I'm from Nashville so I'm biased.,0.096,0.751,0.153,0.5141,1
1495806120,2017-05-26,"1. Spectrum Case (sold for $3) 2. Sold it. 3. #WEW 4. Don't follow hockey, but I've heard that Chicago and LA are good.",0.0,0.857,0.143,0.5927,1
1495806286,2017-05-26,"Spectrum Case When it was around $2.5. Sold it immediately lol WEW Sorry, don't really watch sports. Thanks for the giveaway!",0.051,0.704,0.245,0.7145,1
1495811475,2017-05-26,"My best drop was a spectrum case. This wasn't even when they were first released, so as you can tell my luck isn't the best. I sold it and made like 80 cents profit. WEW",0.046,0.588,0.366,0.9403,1
1495823020,2017-05-26,A spectrum case...,0.0,1.0,0.0,0.0,2
1495828114,2017-05-26,"* The best drop I had was a Spectrum case. As I started playing only 3-4 months ago. I sold it instantly as it was worth a lot at that time and bought my whole inventory. Also, I'm hoping to get something from this operation. * WEW * No Idea about hockey. Thank you",0.076,0.69,0.234,0.836,1
1495829864,2017-05-26,Got twi spectrum cases in a row. Was worth a lot at the time so i sold one and opened the other. Got a awp fever dream which i sold and used the money to buy more keys and case. Did a giveaway shortly after saying i was a fool. Was a few good months ago. I dont watch hockey. Im from one of the two only double landlocked countries in the world. So yeah. Thanks for gifwey Edit: wew,0.037,0.806,0.157,0.8211,1
1495833571,2017-05-26,Best drop would be a spectrum case. I sold it. I needed that half a dollar so bad.I really did! WEW! Not a huge sports fan in general. Thanks mate!,0.177,0.588,0.235,0.6062,1
1495842190,2017-05-26,1. Got a Spectrum Case drop after a match on the first day of its release 2. Sold it for profit since it's a new case 3. WEW,0.075,0.821,0.104,0.2023,1
1495843284,2017-05-27,Best drop: Spectrum Case at its prime Sold it WEW Blackhawks ftw!! ... actually no idea Thanks for the giveaway!,0.142,0.495,0.363,0.826,1
1511908096,2017-11-28,"[trade link](https://steamcommunity.com/tradeoffer/new/?partner=72780456&amp;token=Z-DQTGxs) I unboxed my first case for my birthday. It was the new spectrum 2 case. I was hoping for that red, then I got a jungle slipstream scar :( feelsbadman Thanks op!",0.083,0.745,0.172,0.4753,2
1511971679,2017-11-29,Spectrum 2 case^op,0.0,1.0,0.0,0.0,1
1511994745,2017-11-29,"having cs for as long as I have, i've probably spent like $100 total on keys. So like 40 cases in total. I've only opened like 10 spectrum 2 cases total tho (the case that i got the knife from)",0.0,0.819,0.181,0.7579,1
1514834843,2018-01-01,"[Trade Link](https://steamcommunity.com/tradeoffer/new/?partner=243563&amp;token=W0FHsiRv) Spectrum cases are cool, so I think it's a nice idea :-)",0.0,0.54,0.46,0.7693,1
1528806039,2018-06-12,"Heres my trade link man! would love to get a spectrum 2 case, thanks alot !! glHF!",0.0,0.611,0.389,0.8507,1
1546215628,2018-12-31,"Throw some Spectrum cases my way, OP! [Tradelink](https://steamcommunity.com/tradeoffer/new/?partner=100773472&amp;token=0deeKAMa) 612 for the number.",0.0,0.874,0.126,0.1511,2
1554316029,2019-04-03,Thanks for the giveaway OP! &lt;3 Spray: Heart (Dust Brown) or Tilt (Blood Red) Case: Clutch Case or Spectrum Case [Trade Link](https://steamcommunity.com/tradeoffer/new/?partner=878552051&amp;token=i9Uo9a5K) ////// [OP's Youtube Channel](https://www.youtube.com/channel/UCfjdm_XSWL24L8spqtlOUGQ?sub_confirmation=1) \- If you wanna support his generosity,0.0,0.758,0.242,0.8608,2
1554371903,2019-04-04,thanks you so much for your reply you dont know how much i appreciate that. as for case anything will do at this point. maybe i could have a bunch of Spectrum cases. the amount is up to you. ill take as many as you can spare. and again thanks,0.052,0.792,0.157,0.6908,2
