ITEM,ITEMS
"Sticker | Cloud9 (Glitter) | Copenhagen 2024", "Cloud9, Cloudnine, Cloud Nine, CloudNin, CloudN9, Cloude9, CloudeNine, CloudeNin, CloudeN9, Clod9, ClodNine, ClodNin, ClodN9, Cloude9, CloudeNine, CloudeNin, CloudeN9, Clod9, ClodNine, ClodNin, ClodN9, Cloude9, CloudeNine, CloudeNin, CloudeN9, Clod9, ClodNine, ClodNin, ClodN9, Cloude9, CloudeNine, CloudeNin, CloudeN9, Clod9, ClodNine, ClodNin, ClodN9, Cloude9, CloudeNine, CloudeNin, CloudeN9, Clod9, ClodNine, ClodNin, ClodN9, Cloude9, CloudeNine, CloudeNin, CloudeN9, Clod9, ClodNine"
"P250 | Franklin (Field-Tested)", "Franklin, Frankln, Franklyn, Frankin, Franclin, Franklinn, Franklinn, Franklinn, Franklinn, Franklinn, Franklinn, Franklinn, Franklinn, Franklinn, Franklinn, Franklinn, Franklinn, Franklinn, Franklinn, Franklinn, Franklinn, Franklinn, Franklinn, Franklinn, Franklinn, Franklinn, Franklinn, Franklinn, Franklinn, Franklinn, Franklinn, Franklinn, Franklinn, Franklinn, Franklinn, Franklinn, Franklinn, Franklinn, Franklinn, Franklinn, Franklinn, Franklinn, Franklinn, Franklinn, Franklinn, Franklinn, Franklinn, Franklinn, Franklinn, Franklinn, Franklinn"
"R8 Revolver | Amber Fade (Field-Tested)", "Amber Fade, Amber Fad, Ambr Fade, Amber Fde, Amber Fad, Ambr Fde, Amber Fdae, Amber Fad, Ambr Fdae, Amber Fdae, Amber Fad, Ambr Fdae, Amber Fdae, Amber Fad, Ambr Fdae, Amber Fdae, Amber Fad, Ambr Fdae, Amber Fdae, Amber Fad, Ambr Fdae, Amber Fdae, Amber Fad, Ambr Fdae, Amber Fdae, Amber Fad, Ambr Fdae, Amber Fdae, Amber Fad, Ambr Fdae, Amber Fdae, Amber Fad, Ambr Fdae, Amber Fdae, Amber Fad, Ambr Fdae, Amber Fdae, Amber Fad, Ambr Fdae, Amber Fdae, Amber Fad, Ambr Fdae, Amber Fdae, Amber Fad, Ambr Fdae, Amber Fdae, Amber Fad, Ambr Fdae, Amber Fdae, Amber Fad, Ambr Fdae"
"G3SG1 | Dream Glade (Minimal Wear)", "Dream Glade, Dream Glad, Drem Glade, Dream Glade, Dream Glade, Drem Glade, Dream Glade, Dream Glade, Drem Glade, Dream Glade, Dream Glade, Drem Glade, Dream Glade, Dream Glade, Drem Glade, Dream Glade, Dream Glade, Drem Glade, Dream Glade, Dream Glade, Drem Glade, Dream Glade, Dream Glade, Drem Glade, Dream Glade, Dream Glade, Drem Glade, Dream Glade, Dream Glade, Drem Glade, Dream Glade, Dream Glade, Drem Glade, Dream Glade, Dream Glade, Drem Glade, Dream Glade, Dream Glade, Drem Glade, Dream Glade, Dream Glade, Drem Glade, Dream Glade, Dream Glade, Drem Glade, Dream Glade, Dream Glade, Drem Glade, Dream Glade, Dream Glade, Drem Glade"
"M4A4 | Converter (Factory New)", "Converter, Convertor, Converer, Converetr, Convertee, Converotr, Converotr, Converotr, Converotr, Converotr, Converotr, Converotr, Converotr, Converotr, Converotr, Converotr, Converotr, Converotr, Converotr, Converotr, Converotr, Converotr, Converotr, Converotr, Converotr, Converotr, Converotr, Converotr, Converotr, Converotr, Converotr, Converotr, Converotr, Converotr, Converotr, Converotr, Converotr, Converotr, Converotr, Converotr, Converotr, Converotr, Converotr, Converotr, Converotr, Converotr, Converotr, Converotr, Converotr, Converotr"
"XM1014 | Zombie Offensive (Factory New)", "Zombie Offensive, Zombi Offensive, Zombie Ofensive, Zombie Offencive, Zombie Offencive, Zombie Offencive, Zombie Offencive, Zombie Offencive, Zombie Offencive, Zombie Offencive, Zombie Offencive, Zombie Offencive, Zombie Offencive, Zombie Offencive, Zombie Offencive, Zombie Offencive, Zombie Offencive, Zombie Offencive, Zombie Offencive, Zombie Offencive, Zombie Offencive, Zombie Offencive, Zombie Offencive, Zombie Offencive, Zombie Offencive, Zombie Offencive, Zombie Offencive, Zombie Offencive, Zombie Offencive, Zombie Offencive, Zombie Offencive, Zombie Offencive, Zombie Offencive, Zombie Offencive, Zombie Offencive, Zombie Offencive, Zombie Offencive, Zombie Offencive, Zombie Offencive, Zombie Offencive, Zombie Offencive, Zombie Offencive, Zombie Offencive, Zombie Offencive, Zombie Offencive, Zombie Offencive, Zombie Offencive, Zombie Offencive, Zombie Offencive, Zombie Offencive"
"Sticker | Lynn Vision (Glitter) | Copenhagen 2024","Lynn Vision, Lyn Vision, Lynn Vison, Lynn Vission, Lynn Vission, Lynn Vission, Lynn Vission, Lynn Vission, Lynn Vission, Lynn Vission, Lynn Vission, Lynn Vission, Lynn Vission, Lynn Vission, Lynn Vission, Lynn Vission, Lynn Vission, Lynn Vission, Lynn Vission, Lynn Vission, Lynn Vission, Lynn Vission, Lynn Vission, Lynn Vission, Lynn Vission, Lynn Vission, Lynn Vission, Lynn Vission, Lynn Vission, Lynn Vission, Lynn Vission, Lynn Vission, Lynn Vission, Lynn Vission, Lynn Vission, Lynn Vission, Lynn Vission, Lynn Vission, Lynn Vission, Lynn Vission, Lynn Vission, Lynn Vission, Lynn Vission, Lynn Vission, Lynn Vission, Lynn Vission, Lynn Vission, Lynn Vission, Lynn Vission, Lynn Vission"
"Dual Berettas | Melondrama (Well-Worn)","Melondrama, Melondramma, Melondramma, Melondramma, Melondramma, Melondramma, Melondramma, Melondramma, Melondramma, Melondramma, Melondramma, Melondramma, Melondramma, Melondramma, Melondramma, Melondramma, Melondramma, Melondramma, Melondramma, Melondramma, Melondramma, Melondramma, Melondramma, Melondramma, Melondramma, Melondramma, Melondramma, Melondramma, Melondramma, Melondramma, Melondramma, Melondramma, Melondramma, Melondramma, Melondramma, Melondramma, Melondramma, Melondramma, Melondramma, Melondramma, Melondramma, Melondramma, Melondramma, Melondramma, Melondramma, Melondramma, Melondramma, Melondramma, Melondramma, Melondramma"
"M4A1-S | Night Terror (Factory New)", "Night Terror, Night Teror, Night Terrror, Night Terorr, Night Terro, Night Terorr, Night Terro, Night Terorr, Night Terro, Night Terorr, Night Terro, Night Terorr, Night Terro, Night Terorr, Night Terro, Night Terorr, Night Terro, Night Terorr, Night Terro, Night Terorr, Night Terro, Night Terorr, Night Terro, Night Terorr, Night Terro, Night Terorr, Night Terro, Night Terorr, Night Terro, Night Terorr, Night Terro, Night Terorr, Night Terro, Night Terorr, Night Terro, Night Terorr, Night Terro, Night Terorr, Night Terro, Night Terorr, Night Terro, Night Terorr, Night Terro, Night Terorr, Night Terro, Night Terorr, Night Terro, Night Terorr, Night Terro, Night Terorr"
"Rezan the Redshirt | Sabre", "Sabre, Saber, Sabere, Rezan the Redshirt, Rezan the Redshrt, Rezan the Redshrit, Rezan the Redshrit, Rezan the Redshrit, Rezan the Redshrit, Rezan the Redshrit, Rezan the Redshrit, Rezan the Redshrit, Rezan the Redshrit, Rezan the Redshrit, Rezan the Redshrit, Rezan the Redshrit, Rezan the Redshrit, Rezan the Redshrit, Rezan the Redshrit, Rezan the Redshrit, Rezan the Redshrit, Rezan the Redshrit, Rezan the Redshrit, Rezan the Redshrit, Rezan the Redshrit, Rezan the Redshrit, Rezan the Redshrit, Rezan the Redshrit, Rezan the Redshrit, Rezan the Redshrit, Rezan the Redshrit, Rezan the Redshrit, Rezan the Redshrit, Rezan the Redshrit, Rezan the Redshrit, Rezan the Redshrit, Rezan the Redshrit, Rezan the Redshrit, Rezan the Redshrit, Rezan the Redshrit, Rezan the Redshrit, Rezan the Redshrit, Rezan the Redshrit, Rezan the Redshrit, Rezan the Redshrit, Rezan the Redshrit, Rezan the Redshrit, Rezan the Redshrit, Rezan the Redshrit, Rezan the Redshrit, Rezan the Redshrit, Rezan the Redshrit, Rezan the Redshrit, Sabre"
"UMP-45 | Moonrise (Minimal Wear)", "Moonrise, Monrise, Moonrize, Moonrse, Moonrize, Moonrse, Moonrize, Moonrse, Moonrize, Moonrse, Moonrize, Moonrse, Moonrize, Moonrse, Moonrize, Moonrse, Moonrize, Moonrse, Moonrize, Moonrse, Moonrize, Moonrse, Moonrize, Moonrse, Moonrize, Moonrse, Moonrize, Moonrse, Moonrize, Moonrse, Moonrize, Moonrse, Moonrize, Moonrse, Moonrize, Moonrse, Moonrize, Moonrse, Moonrize, Moonrse, Moonrize, Moonrse, Moonrize, Moonrse, Moonrize, Moonrse, Moonrize, Moonrse, Moonrize, Moonrse, Moonrize"
"PP-Bizon | Space Cat (Factory New)", "Space Cat, Space Kat, Spase Cat, Spase Kat, Spase Cat, Spase Kat, Spase Cat, Spase Kat, Spase Cat, Spase Kat, Spase Cat, Spase Kat, Spase Cat, Spase Kat, Spase Cat, Spase Kat, Spase Cat, Spase Kat, Spase Cat, Spase Kat, Spase Cat, Spase Kat, Spase Cat, Spase Kat, Spase Cat, Spase Kat, Spase Cat, Spase Kat, Spase Cat, Spase Kat, Spase Cat, Spase Kat, Spase Cat, Spase Kat, Spase Cat, Spase Kat, Spase Cat, Spase Kat, Spase Cat, Spase Kat, Spase Cat, Spase Kat, Spase Cat, Spase Kat, Spase Cat, Spase Kat, Spase Cat, Spase Kat, Spase Cat, Spase Kat"
"PP-Bizon | Space Cat (Minimal Wear)", "Space Cat, Space Kat, Spase Cat, Spase Kat, Spase Cat, Spase Kat, Spase Cat, Spase Kat, Spase Cat, Spase Kat, Spase Cat, Spase Kat, Spase Cat, Spase Kat, Spase Cat, Spase Kat, Spase Cat, Spase Kat, Spase Cat, Spase Kat, Spase Cat, Spase Kat, Spase Cat, Spase Kat, Spase Cat, Spase Kat, Spase Cat, Spase Kat, Spase Cat, Spase Kat, Spase Cat, Spase Kat, Spase Cat, Spase Kat, Spase Cat, Spase Kat, Spase Cat, Spase Kat, Spase Cat, Spase Kat, Spase Cat, Spase Kat, Spase Cat, Spase Kat, Spase Cat, Spase Kat, Spase Cat, Spase Kat, Spase Cat, Spase Kat"
"R8 Revolver | Amber Fade (Minimal Wear)", "Amber Fade, Amber Fad, Amber Faid, Amber Faed, Amber Fadde, Amber Fad, Amber Faid, Amber Faed, Amber Fadde, Amber Fad, Amber Faid, Amber Faed, Amber Fadde, Amber Fad, Amber Faid, Amber Faed, Amber Fadde, Amber Fad, Amber Faid, Amber Faed, Amber Fadde, Amber Fad, Amber Faid, Amber Faed, Amber Fadde, Amber Fad, Amber Faid, Amber Faed, Amber Fadde, Amber Fad, Amber Faid, Amber Faed, Amber Fadde, Amber Fad, Amber Faid, Amber Faed, Amber Fadde, Amber Fad, Amber Faid, Amber Faed, Amber Fadde, Amber Fad, Amber Faid, Amber Faed, Amber Fadde, Amber Fad, Amber Faid, Amber Faed, Amber Fadde, Amber Fad"
"Michael Syfers  | FBI Sniper","Michael Syfers, Micheal Syfers, Michael Sifers, Michael Syfer, Michael Syferss, Michael Syfers, Micheal Syfers, Michael Sifers, Michael Syfer, Michael Syferss, Michael Syfers, Micheal Syfers, Michael Sifers, Michael Syfer, Michael Syferss, Michael Syfers, Micheal Syfers, Michael Sifers, Michael Syfer, Michael Syferss, Michael Syfers, Micheal Syfers, Michael Sifers, Michael Syfer, Michael Syferss, Michael Syfers, Micheal Syfers, Michael Sifers, Michael Syfer, Michael Syferss, Michael Syfers, Micheal Syfers, Michael Sifers, Michael Syfer, Michael Syferss, Michael Syfers, Micheal Syfers, Michael Sifers, Michael Syfer, Michael Syferss, Michael Syfers, Micheal Syfers, Michael Sifers, Michael Syfer, Michael Syferss, Michael Syfers, Micheal Syfers, Michael Sifers, Michael Syfer, Michael Syferss"
"XM1014 | Zombie Offensive (Minimal Wear)", "Zombie Offensive, Zombi Offensive, Zombie Ofensive, Zombie Offencive, Zombie Offencive, Zombie Offencive, Zombie Offencive, Zombie Offencive, Zombie Offencive, Zombie Offencive, Zombie Offencive, Zombie Offencive, Zombie Offencive, Zombie Offencive, Zombie Offencive, Zombie Offencive, Zombie Offencive, Zombie Offencive, Zombie Offencive, Zombie Offencive, Zombie Offencive, Zombie Offencive, Zombie Offencive, Zombie Offencive, Zombie Offencive, Zombie Offencive, Zombie Offencive, Zombie Offencive, Zombie Offencive, Zombie Offencive, Zombie Offencive, Zombie Offencive, Zombie Offencive, Zombie Offencive, Zombie Offencive, Zombie Offencive, Zombie Offencive, Zombie Offencive, Zombie Offencive, Zombie Offencive, Zombie Offencive, Zombie Offencive, Zombie Offencive, Zombie Offencive, Zombie Offencive, Zombie Offencive, Zombie Offencive, Zombie Offencive, Zombie Offencive, Zombie Offencive"
"MP7 | Abyssal Apparition (Well-Worn)", "Abyssal Apparition, Abysal Apparition, Abyssal Aparition, Abyssal Appariton, Abyssal Apparitin, Abyssal Apparitin, Abyssal Apparitin, Abyssal Apparitin, Abyssal Apparitin, Abyssal Apparitin, Abyssal Apparitin, Abyssal Apparitin, Abyssal Apparitin, Abyssal Apparitin, Abyssal Apparitin, Abyssal Apparitin, Abyssal Apparitin, Abyssal Apparitin, Abyssal Apparitin, Abyssal Apparitin, Abyssal Apparitin, Abyssal Apparitin, Abyssal Apparitin, Abyssal Apparitin, Abyssal Apparitin, Abyssal Apparitin, Abyssal Apparitin, Abyssal Apparitin, Abyssal Apparitin, Abyssal Apparitin, Abyssal Apparitin, Abyssal Apparitin, Abyssal Apparitin, Abyssal Apparitin, Abyssal Apparitin, Abyssal Apparitin, Abyssal Apparitin, Abyssal Apparitin, Abyssal Apparitin, Abyssal Apparitin, Abyssal Apparitin, Abyssal Apparitin, Abyssal Apparitin, Abyssal Apparitin, Abyssal Apparitin, Abyssal Apparitin, Abyssal Apparitin, Abyssal Apparitin, Abyssal Apparitin, Abyssal Apparitin"
"FAMAS | Rapid Eye Movement (Battle-Scarred)", "Rapid, Eye, Movement, Rapid eye, Rapid movement, Rapid move, rapid eye move, Rapid Eye Movement, Rapid Eye Movment, Rapid Eye Movemnt, Rapid Eye Movemant, Rapid Eye Movemant, Rapid Eye Movemant, Rapid Eye Movemant, Rapid Eye Movemant, Rapid Eye Movemant, Rapid Eye Movemant, Rapid Eye Movemant, Rapid Eye Movemant, Rapid Eye Movemant, Rapid Eye Movemant, Rapid Eye Movemant, Rapid Eye Movemant, Rapid Eye Movemant, Rapid Eye Movemant, Rapid Eye Movemant, Rapid Eye Movemant, Rapid Eye Movemant, Rapid Eye Movemant, Rapid Eye Movemant, Rapid Eye Movemant, Rapid Eye Movemant, Rapid Eye Movemant, Rapid Eye Movemant, Rapid Eye Movemant, Rapid Eye Movemant, Rapid Eye Movemant, Rapid Eye Movemant, Rapid Eye Movemant, Rapid Eye Movemant, Rapid Eye Movemant, Rapid Eye Movemant, Rapid Eye Movemant, Rapid Eye Movemant, Rapid Eye Movemant, Rapid Eye Movemant, Rapid Eye Movemant, Rapid Eye Movemant, Rapid Eye Movemant, Rapid Eye Movemant, Rapid Eye Movemant, Rapid Eye Movemant, Rapid Eye Movemant, Rapid Eye Movemant, Rapid Eye Movemant, Rapid Eye Movemant, Rapid Eye Movemant"
"FAMAS | Rapid Eye Movement (Well-Worn)", "Rapid, Eye, Movement, Rapid eye, Rapid movement, Rapid move, rapid eye move, Rapid Eye Movement, Rapid Eye Movment, Rapid Eye Movemnt, Rapid Eye Movemant, Rapid Eye Movemant, Rapid Eye Movemant, Rapid Eye Movemant, Rapid Eye Movemant, Rapid Eye Movemant, Rapid Eye Movemant, Rapid Eye Movemant, Rapid Eye Movemant, Rapid Eye Movemant, Rapid Eye Movemant, Rapid Eye Movemant, Rapid Eye Movemant, Rapid Eye Movemant, Rapid Eye Movemant, Rapid Eye Movemant, Rapid Eye Movemant, Rapid Eye Movemant, Rapid Eye Movemant, Rapid Eye Movemant, Rapid Eye Movemant, Rapid Eye Movemant, Rapid Eye Movemant, Rapid Eye Movemant, Rapid Eye Movemant, Rapid Eye Movemant, Rapid Eye Movemant, Rapid Eye Movemant, Rapid Eye Movemant, Rapid Eye Movemant, Rapid Eye Movemant, Rapid Eye Movemant, Rapid Eye Movemant, Rapid Eye Movemant, Rapid Eye Movemant, Rapid Eye Movemant, Rapid Eye Movemant, Rapid Eye Movemant, Rapid Eye Movemant, Rapid Eye Movemant, Rapid Eye Movemant, Rapid Eye Movemant, Rapid Eye Movemant, Rapid Eye Movemant, Rapid Eye Movemant, Rapid Eye Movemant, Rapid Eye Movemant"
"Glock-18 | Umbral Rabbit (Factory New)", "Umbral Rabbit, Umbral Rabit, Umbral Rabitt, Umbral Rabit, Umbral Rabitt, Umbral Rabit, Umbral Rabitt, Umbral Rabit, Umbral Rabitt, Umbral Rabit, Umbral Rabitt, Umbral Rabit, Umbral Rabitt, Umbral Rabit, Umbral Rabitt, Umbral Rabit, Umbral Rabitt, Umbral Rabit, Umbral Rabitt, Umbral Rabit, Umbral Rabitt, Umbral Rabit, Umbral Rabitt, Umbral Rabit, Umbral Rabitt, Umbral Rabit, Umbral Rabitt, Umbral Rabit, Umbral Rabitt, Umbral Rabit, Umbral Rabitt, Umbral Rabit, Umbral Rabitt, Umbral Rabit, Umbral Rabitt, Umbral Rabit, Umbral Rabitt, Umbral Rabit, Umbral Rabitt, Umbral Rabit, Umbral Rabitt, Umbral Rabit, Umbral Rabitt, Umbral Rabit, Umbral Rabitt, Umbral Rabit, Umbral Rabitt, Umbral Rabit, Umbral Rabitt, Umbral Rabit"
"Blackwolf | Sabre", "Blackwolf, Blackwlf, Blackwoolf, Blackwolff, Blackwoolf, Blackwolff, Blackwoolf, Blackwolff, Blackwoolf, Blackwolff, Blackwoolf, Blackwolff, Blackwoolf, Blackwolff, Blackwoolf, Blackwolff, Blackwoolf, Blackwolff, Blackwoolf, Blackwolff, Blackwoolf, Blackwolff, Blackwoolf, Blackwolff, Blackwoolf, Blackwolff, Blackwoolf, Blackwolff, Blackwoolf, Blackwolff, Blackwoolf, Blackwolff, Blackwoolf, Blackwolff, Blackwoolf, Blackwolff, Blackwoolf, Blackwolff, Blackwoolf, Blackwolff, Blackwoolf, Blackwolff, Blackwoolf, Blackwolff, Blackwoolf, Blackwolff, Blackwoolf, Blackwolff, Blackwoolf, Blackwolff"
"Rezan The Ready | Sabre", "Rezan The Ready, Rezan The Redy, Rezan The Reddy, Rezan The Readdy, Rezan The Readi, Rezan The Readie, Rezan The Reedy, Rezan The Rady, Rezan The Reday, Rezan The Readdy, Rezan The Readi, Rezan The Readie, Rezan The Reedy, Rezan The Rady, Rezan The Reday, Rezan The Readdy, Rezan The Readi, Rezan The Readie, Rezan The Reedy, Rezan The Rady, Rezan The Reday, Rezan The Readdy, Rezan The Readi, Rezan The Readie, Rezan The Reedy, Rezan The Rady, Rezan The Reday, Rezan The Readdy, Rezan The Readi, Rezan The Readie, Rezan The Reedy, Rezan The Rady, Rezan The Reday, Rezan The Readdy, Rezan The Readi, Rezan The Readie, Rezan The Reedy, Rezan The Rady, Rezan The Reday, Rezan The Readdy, Rezan The Readi, Rezan The Readie, Rezan The Reedy, Rezan The Rady, Rezan The Reday, Rezan The Readdy, Rezan The Readi, Rezan The Readie, Rezan The Reedy, Rezan The Rady"
"Dual Berettas | Melondrama (Field-Tested)","Melondrama, Melondramma, Melondram, Melondrama, Melondramma, Melondram, Melondrama, Melondramma, Melondram, Melondrama, Melondramma, Melondram, Melondrama, Melondramma, Melondram, Melondrama, Melondramma, Melondram, Melondrama, Melondramma, Melondram, Melondrama, Melondramma, Melondram, Melondrama, Melondramma, Melondram, Melondrama, Melondramma, Melondram, Melondrama, Melondramma, Melondram, Melondrama, Melondramma, Melondram, Melondrama, Melondramma, Melondram, Melondrama, Melondramma, Melondram, Melondrama, Melondramma, Melondram, Melondrama, Melondramma, Melondram, Melondrama, Melondramma"
"MP7 | Abyssal Apparition (Field-Tested)","Abyssal Apparition, Abysal Apparition, Abyssal Aparition, Abyssal Appariton, Abyssal Apparitin, Abyssal Apparition, Abysal Apparition, Abyssal Aparition, Abyssal Appariton, Abyssal Apparitin, Abyssal Apparition, Abysal Apparition, Abyssal Aparition, Abyssal Appariton, Abyssal Apparitin, Abyssal Apparition, Abysal Apparition, Abyssal Aparition, Abyssal Appariton, Abyssal Apparitin, Abyssal Apparition, Abysal Apparition, Abyssal Aparition, Abyssal Appariton, Abyssal Apparitin, Abyssal Apparition, Abysal Apparition, Abyssal Aparition, Abyssal Appariton, Abyssal Apparitin, Abyssal Apparition, Abysal Apparition, Abyssal Aparition, Abyssal Appariton, Abyssal Apparitin, Abyssal Apparition, Abysal Apparition, Abyssal Aparition, Abyssal Appariton, Abyssal Apparitin, Abyssal Apparition, Abysal Apparition, Abyssal Aparition, Abyssal Appariton, Abyssal Apparitin, Abyssal Apparition, Abysal Apparition, Abyssal Aparition, Abyssal Appariton, Abyssal Apparitin"
"The Elite Mr. Muhlik | Elite Crew","The Eite, Elite Crew, Mr Muhlik, Muhlik, Elite Mr, The Elite Mr. Muhlik, The Elite Mr. Muhlick, The Elite Mr. Mulik, The Elite Mr. Muhlic, The Elite Mr. Muhlek, The Elite Mr. Muhlik, The Elite Mr. Muhlick, The Elite Mr. Mulik, The Elite Mr. Muhlic, The Elite Mr. Muhlek, The Elite Mr. Muhlik, The Elite Mr. Muhlick, The Elite Mr. Mulik, The Elite Mr. Muhlic, The Elite Mr. Muhlek, The Elite Mr. Muhlik, The Elite Mr. Muhlick, The Elite Mr. Mulik, The Elite Mr. Muhlic, The Elite Mr. Muhlek, The Elite Mr. Muhlik, The Elite Mr. Muhlick, The Elite Mr. Mulik, The Elite Mr. Muhlic, The Elite Mr. Muhlek, The Elite Mr. Muhlik, The Elite Mr. Muhlick, The Elite Mr. Mulik, The Elite Mr. Muhlic, The Elite Mr. Muhlek, The Elite Mr. Muhlik, The Elite Mr. Muhlick, The Elite Mr. Mulik, The Elite Mr. Muhlic, The Elite Mr. Muhlek, The Elite Mr. Muhlik, The Elite Mr. Muhlick, The Elite Mr. Mulik, The Elite Mr. Muhlic, The Elite Mr. Muhlek, The Elite Mr. Muhlik, The Elite Mr. Muhlick, The Elite Mr. Mulik, The Elite Mr. Muhlic, The Elite Mr. Muhlek, The Elite Mr. Muhlik, The Elite Mr. Muhlick, The Elite Mr. Mulik, The Elite Mr. Muhlic, The Elite Mr. Muhlek"
"MP5-SD | Kitbash (Minimal Wear)", "Kitbash, Kitbashh, Kitbsh, Kitbas, Kitbashh, Kitbsh, Kitbas, Kitbashh, Kitbsh, Kitbas, Kitbashh, Kitbsh, Kitbas, Kitbashh, Kitbsh, Kitbas, Kitbashh, Kitbsh, Kitbas, Kitbashh, Kitbsh, Kitbas, Kitbashh, Kitbsh, Kitbas, Kitbashh, Kitbsh, Kitbas, Kitbashh, Kitbsh, Kitbas, Kitbashh, Kitbsh, Kitbas, Kitbashh, Kitbsh, Kitbas, Kitbashh, Kitbsh, Kitbas, Kitbashh, Kitbsh, Kitbas, Kitbashh, Kitbsh, Kitbas, Kitbashh, Kitbsh, Kitbas, Kitbashh"
"Glock-18 | Vogue (Battle-Scarred)","Vogue, Vouge, Voge, Vugue, Voge, Vouge, Voge, Vugue, Voge, Vouge, Voge, Vugue, Voge, Vouge, Voge, Vugue, Voge, Vouge, Voge, Vugue, Voge, Vouge, Voge, Vugue, Voge, Vouge, Voge, Vugue, Voge, Vouge, Voge, Vugue, Voge, Vouge, Voge, Vugue, Voge, Vouge, Voge, Vugue, Voge, Vouge, Voge, Vugue, Voge, Vouge, Voge, Vugue, Voge, Vouge"
"Sawed-Off | Amber Fade (Factory New)","Amber Fade, Amber Fad, Amber Faid, Amber Faed, Amber Fadde, Amber Fad, Amber Faid, Amber Faed, Amber Fadde, Amber Fad, Amber Faid, Amber Faed, Amber Fadde, Amber Fad, Amber Faid, Amber Faed, Amber Fadde, Amber Fad, Amber Faid, Amber Faed, Amber Fadde, Amber Fad, Amber Faid, Amber Faed, Amber Fadde, Amber Fad, Amber Faid, Amber Faed, Amber Fadde, Amber Fad, Amber Faid, Amber Faed, Amber Fadde, Amber Fad, Amber Faid, Amber Faed, Amber Fadde, Amber Fad, Amber Faid, Amber Faed, Amber Fadde, Amber Fad, Amber Faid, Amber Faed, Amber Fadde, Amber Fad, Amber Faid, Amber Faed, Amber Fadde, Amber Fad"
"MP7 | Anodized Navy (Factory New)","Anodized Navy, Anodized Nav, Anodized Nvy, Anodized Nayy, Anodized Nacy, Anodized Nav, Anodized Nvy, Anodized Nayy, Anodized Nacy, Anodized Nav, Anodized Nvy, Anodized Nayy, Anodized Nacy, Anodized Nav, Anodized Nvy, Anodized Nayy, Anodized Nacy, Anodized Nav, Anodized Nvy, Anodized Nayy, Anodized Nacy, Anodized Nav, Anodized Nvy, Anodized Nayy, Anodized Nacy, Anodized Nav, Anodized Nvy, Anodized Nayy, Anodized Nacy, Anodized Nav, Anodized Nvy, Anodized Nayy, Anodized Nacy, Anodized Nav, Anodized Nvy, Anodized Nayy, Anodized Nacy, Anodized Nav, Anodized Nvy, Anodized Nayy, Anodized Nacy, Anodized Nav, Anodized Nvy, Anodized Nayy, Anodized Nacy, Anodized Nav, Anodized Nvy, Anodized Nayy, Anodized Nacy"
"FAMAS | Rapid Eye Movement (Field-Tested)","Rapid, Eye, Movement, Rapid eye, Rapid movement, Rapid move, rapid eye move, Rapid Eye Movement, Rapid Eye Movment, Rapid Eye Movemnt, Rapid Eye Movemant, Rapid Eye Movemant, Rapid Eye Movemant, Rapid Eye Movemant, Rapid Eye Movemant, Rapid Eye Movemant, Rapid Eye Movemant, Rapid Eye Movemant, Rapid Eye Movemant, Rapid Eye Movemant, Rapid Eye Movemant, Rapid Eye Movemant, Rapid Eye Movemant, Rapid Eye Movemant, Rapid Eye Movemant, Rapid Eye Movemant, Rapid Eye Movemant, Rapid Eye Movemant, Rapid Eye Movemant, Rapid Eye Movemant, Rapid Eye Movemant, Rapid Eye Movemant, Rapid Eye Movemant, Rapid Eye Movemant, Rapid Eye Movemant, Rapid Eye Movemant, Rapid Eye Movemant, Rapid Eye Movemant, Rapid Eye Movemant, Rapid Eye Movemant, Rapid Eye Movemant, Rapid Eye Movemant, Rapid Eye Movemant, Rapid Eye Movemant, Rapid Eye Movemant, Rapid Eye Movemant, Rapid Eye Movemant, Rapid Eye Movemant, Rapid Eye Movemant, Rapid Eye Movemant, Rapid Eye Movemant, Rapid Eye Movemant, Rapid Eye Movemant, Rapid Eye Movemant, Rapid Eye Movemant, Rapid Eye Movemant, Rapid Eye Movemant"
"P250 | Franklin (Minimal Wear)","Franklin, Frankln, Franklyn, Frankin, Franclin, Franklinn, Frankln, Franklyn, Frankin, Franclin, Franklinn, Frankln, Franklyn, Frankin, Franclin, Franklinn, Frankln, Franklyn, Frankin, Franclin, Franklinn, Frankln, Franklyn, Frankin, Franclin, Franklinn, Frankln, Franklyn, Frankin, Franclin, Franklinn, Frankln, Franklyn, Frankin, Franclin, Franklinn, Frankln, Franklyn, Frankin, Franclin, Franklinn, Frankln, Franklyn, Frankin, Franclin, Franklinn, Frankln, Franklyn, Frankin, Franclin, Franklinn"
"StatTrak™ Glock-18 | Moonrise (Field-Tested)","Moonrise, Moonrize, Monrise, Moonrisee, Moonrse, Moonrisse, Moonrise, Moonrize, Monrise, Moonrisee, Moonrse, Moonrisse, Moonrise, Moonrize, Monrise, Moonrisee, Moonrse, Moonrisse, Moonrise, Moonrize, Monrise, Moonrisee, Moonrse, Moonrisse, Moonrise, Moonrize, Monrise, Moonrisee, Moonrse, Moonrisse, Moonrise, Moonrize, Monrise, Moonrisee, Moonrse, Moonrisse, Moonrise, Moonrize, Monrise, Moonrisee, Moonrse, Moonrisse, Moonrise, Moonrize, Monrise, Moonrisee, Moonrse, Moonrisse, Moonrise, Moonrize, Monrise"
"Galil AR | Tuxedo (Factory New)","Tuxedo, Tuxedo, Tuxedo, Tuxedo, Tuxedo, Tuxedo, Tuxedo, Tuxedo, Tuxedo, Tuxedo, Tuxedo, Tuxedo, Tuxedo, Tuxedo, Tuxedo, Tuxedo, Tuxedo, Tuxedo, Tuxedo, Tuxedo, Tuxedo, Tuxedo, Tuxedo, Tuxedo, Tuxedo, Tuxedo, Tuxedo, Tuxedo, Tuxedo, Tuxedo, Tuxedo, Tuxedo, Tuxedo, Tuxedo, Tuxedo, Tuxedo, Tuxedo, Tuxedo, Tuxedo, Tuxedo, Tuxedo, Tuxedo, Tuxedo, Tuxedo, Tuxedo, Tuxedo, Tuxedo, Tuxedo, Tuxedo, Tuxedo"
"P250 | Nevermore (Minimal Wear)","Nevermore, Nevermor, Nevermoore, Nevermor, Nevermoore, Nevermor, Nevermoore, Nevermor, Nevermoore, Nevermor, Nevermoore, Nevermor, Nevermoore, Nevermor, Nevermoore, Nevermor, Nevermoore, Nevermor, Nevermoore, Nevermor, Nevermoore, Nevermor, Nevermoore, Nevermor, Nevermoore, Nevermor, Nevermoore, Nevermor, Nevermoore, Nevermor, Nevermoore, Nevermor, Nevermoore, Nevermor, Nevermoore, Nevermor, Nevermoore, Nevermor, Nevermoore, Nevermor, Nevermoore, Nevermor, Nevermoore, Nevermor, Nevermoore, Nevermor, Nevermoore, Nevermor, Nevermoore, Nevermor, Nevermoore"
"SG 553 | Anodized Navy (Factory New)","Anodized Navy, Anodized Nav, Anodized Nvy, Anodized Nayy, Anodized Nacy, Anodized Nav, Anodized Nvy, Anodized Nayy, Anodized Nacy, Anodized Nav, Anodized Nvy, Anodized Nayy, Anodized Nacy, Anodized Nav, Anodized Nvy, Anodized Nayy, Anodized Nacy, Anodized Nav, Anodized Nvy, Anodized Nayy, Anodized Nacy, Anodized Nav, Anodized Nvy, Anodized Nayy, Anodized Nacy, Anodized Nav, Anodized Nvy, Anodized Nayy, Anodized Nacy, Anodized Nav, Anodized Nvy, Anodized Nayy, Anodized Nacy, Anodized Nav, Anodized Nvy, Anodized Nayy, Anodized Nacy, Anodized Nav, Anodized Nvy, Anodized Nayy, Anodized Nacy, Anodized Nav, Anodized Nvy, Anodized Nayy, Anodized Nacy, Anodized Nav, Anodized Nvy, Anodized Nayy, Anodized Nacy"
