created_utc,date,body,negative,neutral,positive,compound,score
1526334312,2018-05-14,"I'm a bot, *bleep*, *bloop*. Someone has linked to this thread from another place on reddit: - [/r/csgo_trading] [\[Store\] $1320 OPSkins, BTC, Golden Baby Roshan, 4x Crown AK Fire Serpent FT, AWP Medusa FT Crown, Howl MW .071, Howl FT .17, Spearmint MW, Foundation MW, Overprint MW, Karambit Sapphire, Karambit Ruby BTA, Karambit Case Hardened Blue Gem #494 FN, ST Butterfly Marble Fade](https://www.reddit.com/r/csgo_trading/comments/8jg5r4/store_1320_opskins_btc_golden_baby_roshan_4x/) &amp;nbsp;*^(If you follow any of the above links, please respect the rules of reddit and don't vote in the other threads.) ^\([Info](/r/TotesMessenger) ^/ ^[Contact](/message/compose?to=/r/TotesMessenger))*",0.027,0.913,0.06,0.4588,1
1534756958,2018-08-20,Karambit stained mw for fire serpent? :),0.231,0.481,0.288,0.1531,1
1535323660,2018-08-26,Hi your karambit is probably worth arround 600 usd and your fire serpent arround 400,0.139,0.751,0.11,-0.128,1
1539459983,2018-10-13,how much for ak fire serpent quad crown? im interested,0.183,0.611,0.206,0.0772,1
1539710571,2018-10-16,Where's ur fire serpent MW,0.375,0.625,0.0,-0.34,1
1540293436,2018-10-23,"I got a fire serpent .23 with crown on wood , how many keys would you offer?",0.156,0.844,0.0,-0.34,1
1540689531,2018-10-28,"I'm a bot, *bleep*, *bloop*. Someone has linked to this thread from another place on reddit: - [/r/csgotrading] [\[H\] $1550 BTC good cashrep \[W\] CS:GO Hightier (Ruby, Sapphire, Emerald, Fire &amp; Ice, Dragon Lore, Howl, Medusa, ST Fire Serpent, Pandora, Spearmint, Crimson Kimono, Vice etc)](https://www.reddit.com/r/Csgotrading/comments/9rzi6r/h_1550_btc_good_cashrep_w_csgo_hightier_ruby/) &amp;nbsp;*^(If you follow any of the above links, please respect the rules of reddit and don't vote in the other threads.) ^\([Info](/r/TotesMessenger) ^/ ^[Contact](/message/compose?to=/r/TotesMessenger))*",0.064,0.826,0.111,0.5423,1
1541020763,2018-10-31,"I'm a bot, *bleep*, *bloop*. Someone has linked to this thread from another place on reddit: - [/r/csgotrading] [\[H\] $1550 BTC good cashrep \[W\] CS:GO Hightier (Ruby, Sapphire, Emerald, Fire &amp; Ice, Dragon Lore, Howl, Medusa, ST Fire Serpent, Pandora, Spearmint, Crimson Kimono, Vice etc)](https://www.reddit.com/r/Csgotrading/comments/9t30dt/h_1550_btc_good_cashrep_w_csgo_hightier_ruby/) &amp;nbsp;*^(If you follow any of the above links, please respect the rules of reddit and don't vote in the other threads.) ^\([Info](/r/TotesMessenger) ^/ ^[Contact](/message/compose?to=/r/TotesMessenger))*",0.064,0.826,0.111,0.5423,1
1541966873,2018-11-11,I have a fire serpent with crown,0.375,0.625,0.0,-0.34,1
1543156050,2018-11-25,"I'm a bot, *bleep*, *bloop*. Someone has linked to this thread from another place on reddit: - [/r/csgotrading] [\[Store\] BitSkins: ST FN Stiletto Fade .02, Huntsman Sapphire FN .03, Sport Gloves Superconductor MW .12, M9 Lore FT .150 very BTA, AK Fire Serpent FT .22](https://www.reddit.com/r/Csgotrading/comments/a08upg/store_bitskins_st_fn_stiletto_fade_02_huntsman/) &amp;nbsp;*^(If you follow any of the above links, please respect the rules of reddit and don't vote in the other threads.) ^\([Info](/r/TotesMessenger) ^/ ^[Contact](/message/compose?to=/r/TotesMessenger))*",0.037,0.888,0.075,0.4091,1
1543557916,2018-11-30,How manykeys for ak fire serpent 4x crown?,0.255,0.745,0.0,-0.34,1
1544035950,2018-12-05,I was about to send an offer for the fire serpent but I don't see it in ur inventory,0.096,0.904,0.0,-0.1779,1
1544235060,2018-12-08,Ak fire serpent ft .29 with crown on wood +adds?,0.211,0.789,0.0,-0.34,1
1545247537,2018-12-19,B/O in keys for fire serpent?,0.324,0.676,0.0,-0.34,1
1547846514,2019-01-18,The screenshot is a mw Fire Serpent not your M4,0.231,0.769,0.0,-0.34,1
1556313975,2019-04-26,Your fire serpent FT for items worth of 175$?,0.212,0.619,0.168,-0.128,1
1556831268,2019-05-02,"I'm a bot, *bleep*, *bloop*. Someone has linked to this thread from another place on reddit: - [/r/csgotrading] [\[Store\] CS:GO for BTC \/ Dota 2. Butterfly Crimson Web FN, ST MW AK Fire Serpent w\/ Titan holo on wood, Butterfly Fade 98%, 0.00005 M9 Doppler P2, AK Asiimov FN, Crown Foil unapplied](https://www.reddit.com/r/Csgotrading/comments/bk04bb/store_csgo_for_btc_dota_2_butterfly_crimson_web/) &amp;nbsp;*^(If you follow any of the above links, please respect the rules of reddit and don't vote in the other threads.) ^\([Info](/r/TotesMessenger) ^/ ^[Contact](/message/compose?to=/r/TotesMessenger))*",0.03,0.901,0.069,0.4588,1
1558108781,2019-05-17,"added for fire serpent w/ crown, steam name is Dis Ethan",0.194,0.806,0.0,-0.34,1
1558357300,2019-05-20,"I'm a bot, *bleep*, *bloop*. Someone has linked to this thread from another place on reddit: - [/r/tf2trade] [\[H\]AK FIRE SERPENT(0,09FV),PURE Howling Dawn Sticker, TF2 UNUSUAL, AUSTRALIUM \[W\] Only CSGO items.](https://www.reddit.com/r/tf2trade/comments/bqv7w8/hak_fire_serpent009fvpure_howling_dawn_sticker/) &amp;nbsp;*^(If you follow any of the above links, please respect the rules of reddit and don't vote in the other threads.) ^\([Info](/r/TotesMessenger) ^/ ^[Contact](/message/compose?to=/r/TotesMessenger))*",0.054,0.854,0.092,0.3109,1
1558381152,2019-05-20,"I'm a bot, *bleep*, *bloop*. Someone has linked to this thread from another place on reddit: - [/r/csgotrade] [\[H\]AK FIRE SERPENT MW(0,09FV),Howling Dawn Sticker, TF2 UNUSUAL, AUSTRALIUM \[W\] Only CSGO items.](https://www.reddit.com/r/csgotrade/comments/bqy6gn/hak_fire_serpent_mw009fvhowling_dawn_sticker_tf2/) - [/r/csgotrade] [\[H\]AK FIRE SERPENT MW(0,09FV),Howling Dawn Sticker, TF2 UNUSUAL, AUSTRALIUM \[W\] Only CSGO items.](https://www.reddit.com/r/csgotrade/comments/br06tw/hak_fire_serpent_mw009fvhowling_dawn_sticker_tf2/) &amp;nbsp;*^(If you follow any of the above links, please respect the rules of reddit and don't vote in the other threads.) ^\([Info](/r/TotesMessenger) ^/ ^[Contact](/message/compose?to=/r/TotesMessenger))*",0.084,0.844,0.072,-0.2182,1
1558458642,2019-05-21,"I'm a bot, *bleep*, *bloop*. Someone has linked to this thread from another place on reddit: - [/r/csgotrade] [\[H\] MW Ak Fire Serpent, Howling Dawn Sticker, FT Usp-S Road Rash, FT Glock Wasteland Rebel, FT Desert Eagle Mecha Industries \[W\] 133k,105k,4k,3k,2k](https://www.reddit.com/r/csgotrade/comments/brczzg/h_mw_ak_fire_serpent_howling_dawn_sticker_ft_usps/) - [/r/csgotrade] [\[H\] MW Ak Fire Serpent, Howling Dawn Sticker, FT Usp-S Road Rash, FT Glock Wasteland Rebel, FT Desert Eagle Mecha Industries \[W\] 133k,105k,4k,3k,2k](https://www.reddit.com/r/csgotrade/comments/brqrmg/h_mw_ak_fire_serpent_howling_dawn_sticker_ft_usps/) - [/r/csgotrade] [\[H\] MW Ak Fire Serpent, Howling Dawn Sticker, FT Usp-S Road Rash, FT Glock Wasteland Rebel, FT Desert Eagle Mecha Industries \[W\] 133k,105k,4k,3k,2k](https://www.reddit.com/r/csgotrade/comments/brse58/h_mw_ak_fire_serpent_howling_dawn_sticker_ft_usps/) - [/r/csgotrade] [\[H\] MW Ak Fire Serpent, Howling Dawn Sticker, FT Usp-S Road Rash, FT Glock Wasteland Rebel, FT Desert Eagle Mecha Industries \[W\] 133k,105k,4k,3k,2k](https://www.reddit.com/r/csgotrade/comments/bs544z/h_mw_ak_fire_serpent_howling_dawn_sticker_ft_usps/) &amp;nbsp;*^(If you follow any of the above links, please respect the rules of reddit and don't vote in the other threads.) ^\([Info](/r/TotesMessenger) ^/ ^[Contact](/message/compose?to=/r/TotesMessenger))*",0.175,0.79,0.035,-0.9468,1
1559415073,2019-06-01,Sent keys for the fire serpent,0.324,0.676,0.0,-0.34,1
1560143940,2019-06-10,b/o on fire serpent?,0.444,0.556,0.0,-0.34,1
1560366934,2019-06-12,The fire serpent,0.545,0.455,0.0,-0.34,1
1561837408,2019-06-29,st fire serpent 4crown sold out?,0.324,0.676,0.0,-0.34,1
1561916096,2019-06-30,are you interested in ak fire serpent bs .48? lf 70k pure,0.159,0.662,0.179,0.0772,0
1562274222,2019-07-04,"Idk how much a base fs is, but I’d say these stickers add no more than 50k, they don’t look great on a fire serpent",0.224,0.598,0.178,0.1406,2
1565364270,2019-08-09,ST FN Bowie tiger tooth for the fire serpent?,0.231,0.769,0.0,-0.34,1
1565538784,2019-08-11,"Gl on the fire serpent, that seems like such a stretch",0.169,0.493,0.338,0.34,1
1566747526,2019-08-25,fire serpent 118k ?,0.545,0.455,0.0,-0.34,1
1566776229,2019-08-25,Added to nego on fire serpent,0.324,0.676,0.0,-0.34,1
1569532967,2019-09-26,im interested in your 0.11 mw ak fire serpent,0.198,0.579,0.223,0.0772,1
1569874995,2019-09-30,AK Fire Serpent + Keys?,0.444,0.556,0.0,-0.34,1
1569905255,2019-10-01,How many keys for fire serpent?,0.324,0.676,0.0,-0.34,1
1570846686,2019-10-12,Very true. Just check the price of the StatTrack Factory new AWP Oni Taiji lol. I bought one a few months ago and I'm projecting it to rise to around $800 as it couldn't be worth more than a Medusa but perhaps the same price of a Fire Serpent.,0.09,0.83,0.08,-0.1246,2
1570855716,2019-10-12,&gt;t to rise to around $800 as it couldn't be worth more than a Medusa but perh the oni taji should never be as much as a fire serpent or medusa,0.141,0.859,0.0,-0.5319,2
1570860510,2019-10-12,"You would be right to think that but just look at the ratio of supply of the StatTracks versus the Non StatTracks. Once the non StatTracks start getting sold. I guarantee you the price will mirror the Fire Serpent rather Closely. Edit, I think around 2nd quarter of next year is when we'll see a breakout in its price. Also, History tends to repeat itself with high tier skins. Just check the ""Lifetime"" History Chart of the Awp Medusa Field Tested. It just shot up from $300 to $700 then took off from there. Oh and to top it off. It's from the Hydra Case, so there's that as well. Edit 2. To answer your question. It could just be the growth in weed culture? With steady growth of the eSports industry yields lots of publicity to CSGO so just as many new NA players are starting to play CSGO as well as China. Also, Free to play helped out too. To answer your question short though I'd say the price is Rising because the supply is drying up.",0.016,0.845,0.14,0.9731,1
1570861555,2019-10-12,"&gt;p in price and some times very high, take aqua marine revenge st fun the medusa actually looks good though, the oni taji looks disgusting, the hydroponic is iconic, aswell as the fire serpent",0.207,0.653,0.14,-0.4588,2
1571227166,2019-10-16,"I have an AK Fire Serpent, would you be interested in buying for arcs or skins?",0.133,0.718,0.149,0.0772,1
1571881052,2019-10-24,"added, i have a ak-47 fire serpent",0.375,0.625,0.0,-0.34,1
1572533838,2019-10-31,I've got a fn bfk marble fade mw ch shadow daggers and a ft fire serpent,0.156,0.844,0.0,-0.34,1
1573043797,2019-11-06,How much are M9’s and BFK’s buyouts? I have 0.16 Fire Serpent w/ Crown (Foil) on wood. We could figure something out?,0.121,0.879,0.0,-0.4137,1
1574025044,2019-11-17,"I’ll offer a fn ak ch #151 (110 arcs), Medusa bs (30 arcs) and a .20 fire serpent (12 arcs) for your dlore mw.",0.103,0.897,0.0,-0.34,2
1575481262,2019-12-04,"I'm a bot, *bleep*, *bloop*. Someone has linked to this thread from another place on reddit: - [/r/dota2trade] [\[Store\] Tier 2 Max red Crimson Kimonos , Butterfly knife Fade 93% 0.007 , AK fire serpent MW , SG 553 | Integrale MW , Desert Eagle | Cobalt Disruption with holo Katos](https://www.reddit.com/r/Dota2Trade/comments/e62oyb/store_tier_2_max_red_crimson_kimonos_butterfly/) &amp;nbsp;*^(If you follow any of the above links, please respect the rules of reddit and don't vote in the other threads.) ^\([Info](/r/TotesMessenger) ^/ ^[Contact](/message/compose?to=/r/TotesMessenger))*",0.068,0.858,0.075,0.128,1
1575482316,2019-12-04,"I'm a bot, *bleep*, *bloop*. Someone has linked to this thread from another place on reddit: - [/r/dota2trade] [\[Store\] Tier 2 Max red Crimson Kimonos , Butterfly knife Fade 93% 0.007 , AK fire serpent MW , SG 553 | Integrale MW , Desert Eagle | Cobalt Disruption with holo Katos](https://www.reddit.com/r/Dota2Trade/comments/e62yvg/store_tier_2_max_red_crimson_kimonos_butterfly/) &amp;nbsp;*^(If you follow any of the above links, please respect the rules of reddit and don't vote in the other threads.) ^\([Info](/r/TotesMessenger) ^/ ^[Contact](/message/compose?to=/r/TotesMessenger))*",0.068,0.858,0.075,0.128,1
1575684792,2019-12-07,Yo i have a bfk fade that i will gladly trade with you.. as soon as you pay for the fire serpent you scammed,0.157,0.744,0.099,-0.1027,2
1575833458,2019-12-08,Interested in ak fire serpent 0.08?,0.264,0.44,0.297,0.0772,1
1576055377,2019-12-11,Ak Fire serpent 0.08?,0.444,0.556,0.0,-0.34,1
1576240249,2019-12-13,Have fire serpent with crown foil in wood,0.255,0.745,0.0,-0.34,1
1576961284,2019-12-21,"Something worth the same, It can also be a little bit less, i am specifically looking for a fire serpent ft, or hydroponic fn but all offers are welcome",0.056,0.763,0.181,0.5789,1
1578162589,2020-01-04,AK fire serpent 0.08 + bfk vanilla for bfk marble fade ?,0.211,0.789,0.0,-0.34,1
1578238865,2020-01-05,"Hey, fire serpent 0.08 + talon vanilla for ur bfk Doppler ?",0.211,0.789,0.0,-0.34,1
1578848434,2020-01-12,Is your fire serpent still up for trade,0.255,0.745,0.0,-0.34,1
1578963781,2020-01-14,"hello i have a karambit doppler phase 4 that im looking to trade, im interested in the fire serpent.",0.126,0.733,0.141,0.0772,1
1581591085,2020-02-13,Fire serpent cost?,0.545,0.455,0.0,-0.34,2
1581604005,2020-02-13,14 arcanas for fire serpent ft,0.324,0.676,0.0,-0.34,1
1582049407,2020-02-18,Fire serpent how much?,0.444,0.556,0.0,-0.34,1
1582762471,2020-02-27,what kind of fire serpent,0.402,0.598,0.0,-0.4005,1
1582770530,2020-02-27,take arcs for fire serpent?,0.375,0.625,0.0,-0.34,1
1582796797,2020-02-27,Float on Fire Serpent?,0.444,0.556,0.0,-0.34,1
1583242198,2020-03-03,I have a 0.22stt fire serpent with Crown and 3 Vox. 53 arcanas for it https://steamcommunity.com/tradeoffer/new/?partner=114920664&amp;token=smrqzCgr,0.167,0.833,0.0,-0.34,1
1584187299,2020-03-14,where is your fire serpent ?,0.375,0.625,0.0,-0.34,1
1584587178,2020-03-19,My fire serpent ww for your talon vanilla. interested?,0.198,0.579,0.223,0.0772,1
1585060352,2020-03-24,Would love gloves omega+ft fire serpent+some nice karambit/m9 knife :) depending which one are you willing to give :D dont wanna ask for too much but would like to get some little overpay since it would be downgrade :),0.034,0.64,0.326,0.9269,1
1585354863,2020-03-28,I got a MW souvie with 4 berlin foils on it 😎 it should be worth more than a StatTrak Fire serpent in FN,0.124,0.788,0.088,-0.1935,1
