created_utc,date,body,negative,neutral,positive,compound,score
1407386953,2014-08-07,i know its not an ak but i have gut crimson ft knife for fire serpent,0.193,0.807,0.0,-0.4767,1
1420357951,2015-01-04,Ak fire serpent ft,0.444,0.556,0.0,-0.34,1
1426380888,2015-03-15,I can give you a ft fire serpent and adds,0.255,0.745,0.0,-0.34,1
1426906140,2015-03-21,"average fire serpent ft named ""taste the dragon"" for 50k pure",0.194,0.806,0.0,-0.34,1
1427059780,2015-03-22,"Hey, I understand your holding out for offers but it's been almost 24h and I would appreciate it if you decide soon, otherwise I will consider offering someone else my fire serpent and bayonet for their howl. .03 float value howls regularly go for 150k and I have offered you a solid overpay in only two easily sellable items",0.049,0.769,0.183,0.8201,1
1429092255,2015-04-15,I offer you a AK-47 Fire Serpent and 7 Keys for it. Kind of low but still a offer. I can add a LOT of Dota 2 items and Maybe even steam games.,0.119,0.881,0.0,-0.3071,1
1429093123,2015-04-15,fire serpent ST? If no sry. coz im interested only in high tier skins and only CS:GO skins :P,0.181,0.59,0.229,0.3034,1
1430809371,2015-05-05,120k pure + fire serpent ft with full snake?,0.255,0.745,0.0,-0.34,1
1433114106,2015-05-31,which Fire serpent do you have? I got one MW Look https://steamcommunity.com/tradeoffer/new/?partner=78911738&amp;token=McZjJ3YS,0.216,0.784,0.0,-0.4137,1
1435278530,2015-06-26,"have karambit cw mw stattrak, bayonet cw mw stattrak, m9 ft cw stattrak and fire serpent ft stattrak, any interested? https://www.reddit.com/r/csgotrade/comments/3b4xfa/h_mw_stattrak_cw_collection_kara_m9_bayonet_w/",0.1,0.788,0.112,0.0772,1
1436141364,2015-07-06,I have 2 nice offers for you: 1: Stattrak karambit vanilla + stattrak m4 guardian FT + USP Road rash + stattrak p90 asiimov FT 2: Flip doppler ph4 + fire serpent mw (crown sticker) + hyper beast m4 FT,0.135,0.792,0.074,-0.3182,1
1436509919,2015-07-10,83k for fire serpent,0.444,0.556,0.0,-0.34,1
1437490225,2015-07-21,if you can go up to 64 I have a fire serpent with a 0.17 float,0.167,0.833,0.0,-0.34,1
1441568129,2015-09-06,100k plus fire serpent ft hot rod fac new. ww aqua fire elemental ft water elemental ft ssg blood and water mw p90 asiimov ww stattrak and ft for dlore,0.146,0.854,0.0,-0.5859,1
1441714317,2015-09-08,i have a really clean FT Fire serpent. But i dont sell it for 62k only. i am asking ofc over market price. http://images.akamai.steamusercontent.com/ugc/436076625664901871/C1CD98A9A4ED699475230067E28857318E72DEEF/ http://images.akamai.steamusercontent.com/ugc/436076625664901487/FE6C092A80E91079CE74DA894AA0C88E470546B9/ http://images.akamai.steamusercontent.com/ugc/436076625664901036/E3465804C7FA0D7C4C92641AFEF6F6FFF817B2A7/,0.077,0.839,0.084,0.0425,1
1442242846,2015-09-14,well my fire serpent is for sale at 70 keys and that is under market so lmk if your interested at all the skins looks super clean aswell,0.065,0.625,0.31,0.8402,1
1443043295,2015-09-23,"Ah I see, but fire serpent is suuuper expensive",0.307,0.693,0.0,-0.4767,1
1445109281,2015-10-17,Fire Serpent FT Sent for B/O .,0.324,0.676,0.0,-0.34,1
1445298869,2015-10-19,karambit marble fade true fire &amp; ice 0.01 float+ ak-47 fire serpent mw 0.08 + ak fire serpent mw 0.13 + m4a1 hot rod 0.02.,0.248,0.655,0.097,-0.5267,1
1446041735,2015-10-28,That b/O is firm or can I offer? On the fire serpent,0.194,0.806,0.0,-0.34,1
1446042467,2015-10-28,115 pure on the ak fire serpent,0.286,0.714,0.0,-0.34,1
1446043714,2015-10-28,118 keys on the fire serpent.,0.324,0.676,0.0,-0.34,1
1446465449,2015-11-02,Sent for the Fire Serpent,0.375,0.625,0.0,-0.34,1
1446531980,2015-11-03,"I sent you your b/o for the Fire Serpent but you declined, could I ask why?",0.116,0.884,0.0,-0.1779,1
1447427533,2015-11-13,Interested in a 0.26 Fire Serpent with Crown on wood for 75?,0.17,0.638,0.191,0.0772,1
1447756638,2015-11-17,65 keys for FT Fire Serpent,0.324,0.676,0.0,-0.34,1
1447758529,2015-11-17,fire serpent ft 68k add me http://steamcommunity.com/profiles/76561198254152504/,0.286,0.714,0.0,-0.34,1
1447810160,2015-11-18,i added u but where is your fire serpent?,0.341,0.659,0.0,-0.4767,1
1448007150,2015-11-20,"i saw you also have a ft fire serpent, is that up for trade?",0.179,0.821,0.0,-0.34,1
1448309289,2015-11-23,FT ST Fire Serpent 0.16 FV - oled huvitatud ?,0.255,0.745,0.0,-0.34,1
1448351452,2015-11-24,"Hey, love the green loadout! I'm trying for the same thing with a couple differences though, still debating if I want a fire serpent though, very expensive haha. I was thinking kara boreal, daggers DDPAT is my 5th option for a knife but I wish there was an emerald doppler for ultimate awesomeness lol. Definitely not looking forward to buying a FN Nuclear Threat p250 though :p tec9 looks good in ft/mw but p250 really needs fn. What deagle is that? I have an urban rubble but wanted a night (too expensive) and was gonna use flipside stickers like you did. I also want a p90 emerald dragon instead of virus bc it looks nicer, but also pricey af. For M4 I've been using boreal forest but might look into a Poseidon and switch back to a4. I also like the famas, I have a fn colony and it looks like ass.",0.08,0.693,0.227,0.9759,1
1448566743,2015-11-26,"M9 doppler P4, Fire Serpent fr, AWP Graphite st fn and more",0.179,0.821,0.0,-0.34,1
1448567343,2015-11-26,"m9 doppler p4, fire serpent ft, awp graphite fn st and more.",0.179,0.821,0.0,-0.34,1
1449057565,2015-12-02,Fire Serpent (MW) 0.07 W/ Crown Foil sticker,0.255,0.745,0.0,-0.34,1
1449377972,2015-12-06,Fire serpent MW with Crown Foil sticker 0.07 FV,0.231,0.769,0.0,-0.34,1
1449484913,2015-12-07,your fire serpent is a .13 stop lying,0.667,0.333,0.0,-0.7906,1
1449590082,2015-12-08,"i was offerd 50 and read ITS GOT 0,09 FLOAT i was once offerd a fire serpent FT if i had a low float bayonila but at the time i had a float above 3 and he didnt wanna trade so please reconsider",0.083,0.816,0.102,0.4092,1
1450455863,2015-12-18,"i was offerd like 51 pure before but also remember it has low float and before u start going ""NOBODY CARES"" read this i was offerd a ak fire serpent FT for a low float vanilla bayo about 3-4 weeks ago but i had a 3.2 or around there float knife back then",0.149,0.729,0.122,-0.1407,1
1450456981,2015-12-18,Didn't you get a Fire Serpent?,0.0,0.663,0.337,0.2584,1
1450928954,2015-12-24,67 keys for ak fire serpent FT pls the float sucks normal quicksell price 85% is 65 keys! :D,0.192,0.588,0.22,0.184,1
1450997395,2015-12-24,69 keys for ak fire serpent pls it is christmas soon gonna give it to myself as a gift lol xDDD,0.094,0.63,0.276,0.5574,1
1451234996,2015-12-27,116 keys for Fire serpent and m9 vanilla,0.255,0.745,0.0,-0.34,1
1451503605,2015-12-30,Looking for those. M4A1 Knight Dragon Lore FT M9 Marble Fade. M4A1 S Icarus Fell Fire Serpent FT or MW,0.118,0.882,0.0,-0.34,1
1452186095,2016-01-07,interested in ak fire serpent mw?,0.264,0.44,0.297,0.0772,1
1452434881,2016-01-10,"I think your pricing might be a bit off, so far I have been offered a Dlore FT .16 FV (490k), ST Fire serpent FT, CW MW Karambit, &amp; Kill Confirmed (Don't know exact amount)",0.197,0.803,0.0,-0.7964,1
1453335517,2016-01-21,"Yo I've got a P4 flip .03 float and a bs ak fire serpent .5 float. I'd be interested in your flip, but you'd need to add around $100.",0.06,0.876,0.065,0.0387,1
1454758636,2016-02-06,What do you think about FIRE SERPENT MW 0.15 float ?,0.258,0.742,0.0,-0.4824,1
1454789476,2016-02-06,Ak fire serpent MW and Awp Lightning strike fn,0.358,0.642,0.0,-0.4404,1
1454793715,2016-02-06,What about m9 vanilla and ak fire serpent MW,0.231,0.769,0.0,-0.34,1
1455588575,2016-02-16,i have a fire serpent 16fv ft with nip katowice 2014 on wood for 85keys if u want http://steamcommunity.com/sharedfiles/filedetails/?id=621154052,0.136,0.791,0.073,-0.2732,1
1455729096,2016-02-17,Got Ak Fire Serpent FT with 0.25 FV and no scratch and clean ak :) for huntsman,0.197,0.558,0.245,0.2732,1
1456215191,2016-02-23,Howl fire serpent are the 2 best. BFK are good too.,0.145,0.424,0.43,0.6908,1
1456269766,2016-02-23,karam fade + karam Fire ICE + fire serpent FT,0.444,0.556,0.0,-0.5859,1
1456271957,2016-02-23,karam fire ice karam fade 60/40 fire serpent FT,0.407,0.593,0.0,-0.5859,1
1456768509,2016-02-29,fn fire serpent with clean corners - interested?,0.203,0.339,0.458,0.4588,1
1458841189,2016-03-24,0.16 FV Fire serpent for 85 keys,0.286,0.714,0.0,-0.34,1
1459042337,2016-03-27,70/30 Perfect corner! 0.01 float http://imgur.com/a/7k4DE Ak-47 Fire Serpent FN w/ Crown Foil!,0.136,0.622,0.242,0.4374,1
1459072448,2016-03-27,"Got a 0.08 fire serpent, and a m9 TT fn",0.255,0.745,0.0,-0.34,1
1459285853,2016-03-29,Hey there id be happy to take your fire serpent. but I just got to work and I can't use steam on my phone at the moment. If you can hold onto it for 8 hours or so id be happy to buy it,0.036,0.807,0.157,0.7717,1
1459391582,2016-03-31,3 maxbets knives for the fire serpent?,0.324,0.676,0.0,-0.34,2
1459474487,2016-04-01,0.0848 fire serpent 115k or fire serp bundled with stat shadow daggers slaughter for 210k,0.27,0.73,0.0,-0.5859,1
1460021065,2016-04-07,"How did you calculate prices? own preference? - M4 0.02 fv: ($60 x 0.1 / 2.55 * 4) + 51K = ~60K - AK 0.2292 fv: ($60 x 0.1 / 2.55 * 3) + 86K = ~93K - AWP (fv?): ($60 x 0.1 / 2.55 * 3) + 16K = ~23K These are all b/o calculated using steamanalyst prices in keys + stickers calculated in keys (10% of value for each sticker). But even with these prices I don't see you selling these unless you find people like you who have no idea how stickers &amp; prices work. To give you an idea, I sold a MW fire serpent for 130K with a float of 0.08 and it looks scratchless, that's a real price. Cheers.",0.053,0.861,0.086,0.5775,1
1460654997,2016-04-14,"Flip Doppler FN P2 Clear Phase Float: 0,02 Ak-47 Vulcan MW Float: 0,09 Bish+Bash+bosh holo For Fire Serpent My SteamProfil: http://steamcommunity.com/profiles/76561197990581928",0.1,0.792,0.108,0.0516,1
1461132034,2016-04-20,"Fire Serpent yes, any other skins, no",0.407,0.354,0.239,-0.2263,1
1462498001,2016-05-06,"hey man, can you do 86k for the Fire Serpent? If so, ill sell my knife and buy some keys immediately lol Feel free to add me up to talk further! http://steamcommunity.com/id/kaalaa/",0.149,0.693,0.158,0.0966,1
1464139784,2016-05-25,ak fire serpent ft .21 float?,0.324,0.676,0.0,-0.34,1
1464511970,2016-05-29,"The knifes are all fn m9 has blue tip , fire serpent ft with mw look and the hot rod is fn with little scratches",0.094,0.906,0.0,-0.34,1
1464524668,2016-05-29,"&gt; The knifes are all fn m9 has blue tip , fire serpent ft with mw look and the hot rod is fn with little scratches",0.091,0.909,0.0,-0.34,1
1468494622,2016-07-14,125k for fire serpent mw ?,0.375,0.625,0.0,-0.34,1
1468621512,2016-07-15,M9 Marble Blue Tip + FT Fire Serpent?,0.286,0.714,0.0,-0.34,1
1468931599,2016-07-19,Bayo P2 Max pink 0.001 + Ak Fire Serpent FT 0.1600 + M4A4 Poseidon MW 0.071,0.156,0.844,0.0,-0.34,1
1469632364,2016-07-27,"Fire Serpent FT .23, 4x KATO 15 holos looks dope, 85",0.194,0.806,0.0,-0.34,1
1469726292,2016-07-28,do you want to 1:1 my ak fire serpent ft 0.19 float for your bayonet crimson web ????,0.163,0.774,0.063,-0.4696,1
1471326739,2016-08-16,Fire Serpent FT 0.1600 80k?,0.375,0.625,0.0,-0.34,1
1472275909,2016-08-27,I can trade u my 90% blue gem butterfly for just fire serpent. http://s.metjm.net/IDmkqdl.jpg,0.179,0.821,0.0,-0.34,1
1473480093,2016-09-10,"I have a fire serpent mw 0.07, add/pm if interested.",0.216,0.541,0.243,0.0772,1
1476273398,2016-10-12,"heading [Store] AWP | Dragon Lore FT 0.22, Karambit | Fade FN 0.01, st Karambit | Doppler P4 FN 0.03, Karambit | Doppler P4 FN 0.06, Bayonet | Marble Fade FN 0.01, Karambit | Damascus Steel FN 0.06 text Prices negotiable, if you're interested please feel free to add me or offer! b/o (keys,more in items) AWP | Dragon Lore FT 0.2217 350k SS http://steamcommunity.com/sharedfiles/filedetails/?id=776632543 Karambit | Fade FN 0.0173 180k SS http://steamcommunity.com/sharedfiles/filedetails/?id=779492265 http://steamcommunity.com/sharedfiles/filedetails/?id=779492243 Karambit | Doppler P4 ST FN 0.0332 160k SS http://steamcommunity.com/sharedfiles/filedetails/?id=779492110 http://steamcommunity.com/sharedfiles/filedetails/?id=779492127 Karambit | Doppler P4 FN 0.0694 115k SS http://steamcommunity.com/sharedfiles/filedetails/?id=779492145 http://steamcommunity.com/sharedfiles/filedetails/?id=779492165 Bayonet | Marble Fade FN 0.0197 108k SS http://steamcommunity.com/sharedfiles/filedetails/?id=779492179 http://steamcommunity.com/sharedfiles/filedetails/?id=779492190 Karambit | Damascus Steel FN 0.0615 89k SS http://steamcommunity.com/sharedfiles/filedetails/?id=779492200 http://steamcommunity.com/sharedfiles/filedetails/?id=779492227 AK-47 | Fire Serpent ST BS 0.4597 160k SS http://steamcommunity.com/sharedfiles/filedetails/?id=772221456 Just send me steam offer guys https://steamcommunity.com/tradeoffer/new/?partner=123854250&amp;token=SbV2QK0B or add me or ask me here if u want something",0.017,0.903,0.079,0.8152,1
1477440341,2016-10-26,you offer me all that? I would like the fire serpente +?,0.168,0.631,0.201,0.1179,1
1479331979,2016-11-16,"m9 bayonet doppler phase 4 max blue and m9 bayonet slaughter mw, i let u check pattern, for karam doppler p4 and ak fire serpent ft, i can aswell put m4 hyper beast in, i suppose u gonna say no :D",0.113,0.788,0.099,0.1111,1
1480060867,2016-11-25,Would you trade the fire serpent for another one without sticker plus adds?,0.167,0.833,0.0,-0.34,1
1480459882,2016-11-29,"hahahaha, i got a FN Dlore, an FN Howl, and a MW Fire Serpent. So fuck you and have a nice day",0.258,0.625,0.117,-0.5256,1
1483481773,2017-01-03,60k for fire serpent ft,0.375,0.625,0.0,-0.34,1
1483557728,2017-01-04,60 keys for ft fire serpent,0.324,0.676,0.0,-0.34,1
1483575522,2017-01-05,That price on the fire serpent is insane. Good luck getting any offers.,0.255,0.45,0.295,0.2023,1
1483662134,2017-01-06,63k fire serpent,0.545,0.455,0.0,-0.34,1
1484354627,2017-01-14,"Hey, im intressted in the Fire serpent FT ST add me please. My name is KRAMBJORNEN! :)",0.109,0.637,0.254,0.4926,1
1486301413,2017-02-05,AK Fire serpent FT w/ crown on wood/. https://steamcommunity.com/tradeoffer/new/?partner=35997510&amp;token=vqkv6cMp,0.231,0.769,0.0,-0.34,1
1486366653,2017-02-06,AK 47 Fire serpent with crown on wood https://steamcommunity.com/tradeoffer/new/?partner=35997510&amp;token=vqkv6cMp,0.231,0.769,0.0,-0.34,1
1487148246,2017-02-15,Thanks for your offer but I can get 74 keys from a tradebot aswell :/. This is a 18 float FT Fire Serpent..,0.134,0.781,0.085,-0.2846,1
1488076738,2017-02-26,That metjm is for a fire serpent,0.324,0.676,0.0,-0.34,1
1488134879,2017-02-26,I have fire serpent. I cant Bother choosing 108keys in a trade offer because I am on my phone. If you want send me a offer with 108keys. https://steamcommunity.com/tradeoffer,0.09,0.785,0.125,-0.0165,1
1488389294,2017-03-01,P1 bayo doppler + keys for the fire serpent?,0.255,0.745,0.0,-0.34,1
1488428069,2017-03-02,75 for fire serpent?2,0.444,0.556,0.0,-0.34,1
1488738355,2017-03-05,AK-47 Fire serpent FT 0.28 with nametag and Sticker | New Sheriff (Foil) on wood,0.156,0.844,0.0,-0.34,1
1488753371,2017-03-05,What's the float of the fire serpent? And how many keys for that?,0.187,0.813,0.0,-0.4137,1
1488884056,2017-03-07,steam profile ? fire serpent ft 0.15402961 for 82k,0.255,0.745,0.0,-0.34,1
1489051110,2017-03-09,"Interested in a Kara sapphire .03, Kara gamma doppler p3 .03 , mw fire serpent, st fn desolate space for Kara emerald ?",0.104,0.779,0.117,0.0772,1
1489063343,2017-03-09,Would a Fire Serpent MW and a MW Freehand ST be good for the flip sapphire?,0.135,0.618,0.247,0.25,1
1489064270,2017-03-09,"For the Flip, MW Fire Serpent, and MW FreeHand St?",0.202,0.672,0.126,-0.2263,1
1491226335,2017-04-03,Ak fire serpent 72,0.444,0.556,0.0,-0.34,1
1491227900,2017-04-03,Ak fire serpent 72?,0.444,0.556,0.0,-0.34,1
1491326120,2017-04-04,Interested in ak fire serpent ft? (72k),0.238,0.495,0.267,0.0772,1
1491326652,2017-04-04,Ak fire serpent goes for 75 or 80 with good fv...so 72 is good,0.125,0.573,0.302,0.5267,1
1491376285,2017-04-05,Ak fire serpent ft 73 keys,0.324,0.676,0.0,-0.34,1
1491389418,2017-04-05,72 for ak fire serpent ft,0.324,0.676,0.0,-0.34,1
1492630012,2017-04-19,Fire Serpent 0.16 for 79 pure?,0.324,0.676,0.0,-0.34,1
1492812943,2017-04-21,"what about fire serpent, asiimov, graphite?",0.324,0.676,0.0,-0.34,1
1492817102,2017-04-21,103keys +350 cases for fire serpent,0.324,0.676,0.0,-0.34,1
1492826153,2017-04-22,Fire serpent like 84 Asimov I don't know I have never owned a tri holo And graphite like 25 keys (Non of them are holo you said ),0.085,0.739,0.176,0.3818,2
1492856262,2017-04-22,"About graphite, that's too low, if you check other threads, many graphites with ibuypower on schope was sold for 45-55, not lower. I think ~ 40 is perfect price? About m4 asii regular one is about ~ 22-23, mine is with crown + ft look, i think 27-30 is perfect. Fire serpent yeap. About m4 awp, why tri? isn't it's called quadra/quad? One guy said it's 80, other 110. So i've made 100, on the middle.",0.056,0.822,0.122,0.7452,1
1493031738,2017-04-24,[H]Ak Fire Serpent Float 0.16 [W]81k,0.324,0.676,0.0,-0.34,1
1493064295,2017-04-24,why are you asking almost market value for MW Fire Serpent smh,0.297,0.569,0.134,-0.3774,1
1493639935,2017-05-01,77k for fire serpent?,0.444,0.556,0.0,-0.34,1
1493862704,2017-05-04,st fire serpent mw for bayo sapph.,0.286,0.714,0.0,-0.34,1
1495152177,2017-05-19,No on the Fire Serpent ( One with a Crown just sold for 120 ) And the Kara Doppler I got offerd 158 last night,0.195,0.805,0.0,-0.5574,1
1495286515,2017-05-20,Fire serpent mw + keys?,0.444,0.556,0.0,-0.34,1
1499284719,2017-07-05,interested on a fire serpent 0.18 fv with crown on wood + 40 keys for the mw fire serpent with 3 lgb's ?,0.204,0.681,0.115,-0.2732,1
1500735110,2017-07-22,"Hey, dude. I got a sweet looking AK-47 | Fire Serpent MW for you. It's got a FV of 0.11. My B/O is 114k, which is like 88% of SA price. Hmu if you're interested. [This is the metjm of it.](https://s.metjm.net/0p6C7cq.jpg)",0.055,0.757,0.188,0.7003,1
1501374479,2017-07-30,Bs fire serpent with a crown,0.375,0.625,0.0,-0.34,1
1501453550,2017-07-30,You're telling me you are selling a Fire Serpent for 105 dollars? ($2.09 per key on opskins),0.138,0.862,0.0,-0.34,1
1503998646,2017-08-29,interested in ak-47 fire serpent and gut doppler or the flip slaughter,0.159,0.662,0.179,0.0772,1
1505672950,2017-09-17,"How many keys for a 0.08 float Fire Serpent MW with ""Sticker: Natus Vincere (Holo) | Katowice 2015"" on wood?",0.124,0.876,0.0,-0.34,1
1506223193,2017-09-24,84k fire serpent,0.545,0.455,0.0,-0.34,1
1506457113,2017-09-26,.10 mw fire serpent how much,0.324,0.676,0.0,-0.34,1
1506761780,2017-09-30,85k for a st ak fire serpent lel :D,0.193,0.483,0.324,0.3885,1
1507229215,2017-10-05,82 k for the ak serpent,0.0,1.0,0.0,0.0,1
1513261236,2017-12-14,"sir, are you interested in an ak fire serpent stattrak min wear with a float value ranked at 2nd among the rest.",0.094,0.706,0.2,0.4019,1
1517707429,2018-02-04,Interested in skins? I can do an FT Fire Serpent + adds for Bayonet Doppler if interested. https://steamcommunity.com/tradeoffer/new/?partner=375754752&amp;token=CjRx4SJj,0.113,0.614,0.272,0.5204,1
1517722528,2018-02-04,Your gut knife and the fire serpent cuz downgrade u need to overpay a lil bit,0.156,0.844,0.0,-0.34,1
1518375360,2018-02-11,"I'm a bot, *bleep*, *bloop*. Someone has linked to this thread from another place on reddit: - [/r/csgotrading] [\[Store\] 840 keys, Sapphire \/ Ruby \/ Emerald \/ Fire &amp; Ice \/ Max Fake Fire &amp; Ice \/ Pandora's Box Gloves \/ 0.07 AK Fire Serpent \/ #1 M9 Gamma Doppler 0.0002 \/ 0.004 M9 Marble Fade 2nd Max Red Tip \/ Karambit CH Blue Gem #494 MW \/ Karambit Crimson Web 0.12 BTA \/ Five-seveN CH #872 \/ NiP Kato 14 Holo](https://www.reddit.com/r/Csgotrading/comments/7wuogy/store_840_keys_sapphire_ruby_emerald_fire_ice_max/) &amp;nbsp;*^(If you follow any of the above links, please respect the rules of reddit and don't vote in the other threads.) ^\([Info](/r/TotesMessenger) ^/ ^[Contact](/message/compose?to=/r/TotesMessenger))*",0.091,0.862,0.047,-0.5994,1
1518443185,2018-02-12,Price of the fire serpent?,0.375,0.625,0.0,-0.34,1
1520611961,2018-03-09,"I'm a bot, *bleep*, *bloop*. Someone has linked to this thread from another place on reddit: - [/r/csgo_trading] [\[Store\] M9 Emerald, M9 Sapphire, M9 Ruby, Bayonet Emerald MW, Kara F&amp;I 3rd, Karambit Fire &amp; Ice .006 very BTA, Karambit Tiger Tooth .01 very BTA, AWP Dragon Lore MW .084, Medusa BS, ST AK Fire Serpent MW Crown on wood, Pandora's Box FT, .150 Gloves Crimson Weave, .16 Hedge Maze, Superconductor MW](https://www.reddit.com/r/csgo_trading/comments/837s8n/store_m9_emerald_m9_sapphire_m9_ruby_bayonet/) &amp;nbsp;*^(If you follow any of the above links, please respect the rules of reddit and don't vote in the other threads.) ^\([Info](/r/TotesMessenger) ^/ ^[Contact](/message/compose?to=/r/TotesMessenger))*",0.048,0.897,0.054,0.1531,1
1520670837,2018-03-10,"I'm a bot, *bleep*, *bloop*. Someone has linked to this thread from another place on reddit: - [/r/csgo_trading] [\[Store\] M9 Emerald, Karambit Sapphire BTA, M9 Ruby, Bayonet Emerald MW, Kara F&amp;I 3rd, Karambit Fire &amp; Ice .006 very BTA, Karambit Tiger Tooth .01 very BTA, AWP Dragon Lore MW .084, ST AK Fire Serpent MW Crown on wood, Pandora's Box FT, .150 Gloves Crimson Weave, .16 Hedge Maze, Superconductor MW](https://www.reddit.com/r/csgo_trading/comments/83e06w/store_m9_emerald_karambit_sapphire_bta_m9_ruby/) &amp;nbsp;*^(If you follow any of the above links, please respect the rules of reddit and don't vote in the other threads.) ^\([Info](/r/TotesMessenger) ^/ ^[Contact](/message/compose?to=/r/TotesMessenger))*",0.049,0.896,0.055,0.1531,1
1521996093,2018-03-25,"Hey, interested in a m9 p4 bta blue / ak47 fire serpent ft? Would need adds tho.",0.133,0.718,0.149,0.0772,1
1523896927,2018-04-16,Also will accept Ak fire serpent mw with crown foil on wood + adds,0.15,0.688,0.163,0.0516,1
1524938923,2018-04-28,Have ak fire serpent with crown on wood if interested,0.183,0.611,0.206,0.0772,1
1525806330,2018-05-08,i have 0.24 fire serpent for bronzed gloves,0.286,0.714,0.0,-0.34,1
1526234061,2018-05-13,"Other posts from u/chi11a in r/csgotrade: [[H]SPORT GLOVES CRIMSON KIMONO WW(0,38) [W] Tradeoffers, pref BFK vanilla+keys](http://reddit.com/r/csgotrade/comments/8i5v51/hsport_gloves_crimson_kimono_ww038_w_tradeoffers/) [[H]Flip Gamma Doppler Phase2 (0,009 fv) &amp; AWP Lightning Strike FN(0,007fv) &amp; Specialist Gloves Emerald web FT(0,27fv) &amp; Butterfly Vanilla &amp; Flip Knife freehand FT [W] Downgrade+adds or fair trades! https://s.metjm.net/JXAVLyB.jpg](http://reddit.com/r/csgotrade/comments/8h5v8v/hflip_gamma_doppler_phase2_0009_fv_awp_lightning/) [[H] Clean Look Pandoras Box Gloves (0,38 WW) [W] Fair tradeoffers! http://imgur.com/gallery/ExEaTnL](http://reddit.com/r/csgotrade/comments/8gq6rj/h_clean_look_pandoras_box_gloves_038_ww_w_fair/) [[H] Pandora's Box WW (GOOD FLOAT and look: 0.38) [W] Tradeoffer! (Prefer specialist gloves + knife)](http://reddit.com/r/csgotrade/comments/8gfka6/h_pandoras_box_ww_good_float_and_look_038_w/) [[PC] Flip knife gamma Doppler PH2 (0.007 fv)](http://reddit.com/r/csgotrade/comments/8g9fnv/pc_flip_knife_gamma_doppler_ph2_0007_fv/) [[H] AK-47 Fire Serpent (crown+0.09) [W] BFK Tiger tooth](http://reddit.com/r/csgotrade/comments/8fbriu/h_ak47_fire_serpent_crown009_w_bfk_tiger_tooth/) ^(I am a bot and this action was performed automatically.)",0.036,0.874,0.09,0.6981,2
1526302331,2018-05-14,"Other posts from u/chi11a in r/csgotrade: [[PC] Specialist Gloves Crimson Kimono BS](http://reddit.com/r/csgotrade/comments/8j5kll/pc_specialist_gloves_crimson_kimono_bs/) [[H]SPORT GLOVES CRIMSON KIMONO WW(0,38) [W] Tradeoffers, pref BFK vanilla+keys](http://reddit.com/r/csgotrade/comments/8i5v51/hsport_gloves_crimson_kimono_ww038_w_tradeoffers/) [[H]Flip Gamma Doppler Phase2 (0,009 fv) &amp; AWP Lightning Strike FN(0,007fv) &amp; Specialist Gloves Emerald web FT(0,27fv) &amp; Butterfly Vanilla &amp; Flip Knife freehand FT [W] Downgrade+adds or fair trades! https://s.metjm.net/JXAVLyB.jpg](http://reddit.com/r/csgotrade/comments/8h5v8v/hflip_gamma_doppler_phase2_0009_fv_awp_lightning/) [[H] Clean Look Pandoras Box Gloves (0,38 WW) [W] Fair tradeoffers! http://imgur.com/gallery/ExEaTnL](http://reddit.com/r/csgotrade/comments/8gq6rj/h_clean_look_pandoras_box_gloves_038_ww_w_fair/) [[H] Pandora's Box WW (GOOD FLOAT and look: 0.38) [W] Tradeoffer! (Prefer specialist gloves + knife)](http://reddit.com/r/csgotrade/comments/8gfka6/h_pandoras_box_ww_good_float_and_look_038_w/) [[PC] Flip knife gamma Doppler PH2 (0.007 fv)](http://reddit.com/r/csgotrade/comments/8g9fnv/pc_flip_knife_gamma_doppler_ph2_0007_fv/) [[H] AK-47 Fire Serpent (crown+0.09) [W] BFK Tiger tooth](http://reddit.com/r/csgotrade/comments/8fbriu/h_ak47_fire_serpent_crown009_w_bfk_tiger_tooth/) *I am a bot and this action was performed automatically. Downvote to remove|[Blacklist](https://www.reddit.com/message/compose/?to=allsubmissionbot&amp;subject=blacklist&amp;message=blacklist)*",0.033,0.884,0.083,0.6981,1
