created_utc,date,body,negative,neutral,positive,compound,score
1595345947,2020-07-21,On my non prime I got a double drop (rare) and i got the AWp medusa and the Ak 47 fire serpent at rank 2,0.191,0.809,0.0,-0.5423,-7
1598886572,2020-08-31,"I’m getting a fire serpent in 2 weeks, deadass was going to buy a new phone and make a new account to be safe",0.103,0.773,0.124,0.128,6
1608615689,2020-12-22,I remember someone on novo posting about 2 fire serpents getting banned,0.403,0.597,0.0,-0.6597,6
1609839156,2021-01-05,"Man I wouldn't even dare to hack with a fire serpent, how tf do you have so much spare money?",0.124,0.876,0.0,-0.34,1
1623883883,2021-06-16,My main got red trust a few weeks ago despite me not even using it a single time with cheats or injecting into the game. Yesterday it got banned because the alt I used to spin on got banned even though a phone number was not attached. I transferred all my skins when I got red trust cause I invested in a fire serpent qnd was Sussed out.,0.155,0.735,0.11,-0.5106,3
1628076798,2021-08-04,"i first started retaliation cheating with TMCheats until i was handed a fat vac. My second account was made in 2016 when i was invited to skeet and novo it remained unbanned until it got overwatched last year. i mainly semi raged and closeted on it as i was in the weird green trust where its either a 5 stack of semi ragers or legits. the account before ban had a fire serpent and an m9 slaughter as overwatch bypass, the m9 made it off but the fire serpent and greeds fire serpent were banned. so basically retaliation cheating turned me into a money flexing unknown semi rager that lost money in the end",0.243,0.74,0.017,-0.9777,7
